Head Word,Date,Source,Author,Vol / Page,Edition,Quote,Notes
ope,1986,"Matriarch, The",IHIMAERA,74,,"There was a murmur of amusement from behind the matriarch where the ope ... were ranged in support of the matriarch and the elders. <i>Ibid.</i> 75 The child followed the pathway that her gaze had taken, to where a Maori elder, the first to stand to greet the ope, was preparing to begin his whaikorero.",
ope,1995,Mana,,10 : 11,,"Te Arawa pulled the rug out from under Whata and his ope by simply repeating something they'd all heard Pat say: ""Bury me where I drop.""",
open,"Nov 18, 1880",Bay of Plenty Times,,3,,Those of Mokena's family who have signified their willingness to dispose of their share in the block say the akuhata's refusal to sign will not deter them from having the field thrown open for gold mining purposes and that the question of proclaiming the field is now in the hands of the authorities.,
open,"Sep 29, 1898",Otago Witness,,18,,"Within 12 months from date there should be a large area of auriferous land thrown open for gold mining, as it is anticipated that by then the Kelly's Terrace tail-race, now being driven under Government subsidy, will be completed.",
open,"Sep 16, 1908",Otago Witness,,22,,"In reference to opening the lands covered by the Barewood pastoral lease for mining purposes, the Prime Minister to-day stated that the matter had been considered by the Mines Department, when it was decided that it was not expedient to proclaim the land in question open for gold mining.",
open,"Sep 24, 1853",Richmond-Atkinson Papers,,1/131,1960,"Some ...[sic] who wished to stop, intend proceeding to Auckland as they are frightened of bush land, and the block containing fern, which will be next opened, is hardly likely to be in the market for 6 months to come.",
open,1887,Handbook NZ Mines,,8,,About the same time several gullies were opened in the Umbrella Ranges; and on the banks of the Waikaia ... [9] a permanent goldfield ... was also discovered.,1863 V. Pyke's Report in 1887 Handbook NZ Mines
open,"Sep 30, 1873","Star, The",,2,,"He has sent a message to the King for assistance to drive off surveyors, as the Ngatimaru have openly declared their intention of throwing the block open for gold mining when surveyed.",
Open Bay Islands gecko,Sep 1997,Internet - see Notes,,,,"Other notable faunainclude the endemic Open Bay Islands leech and Open Bay Islands skink (<i>Oligosoma</i> ""Open Bay Islands""), Open Bay Islands gecko (<i>Hoplodactylus</i> ""Open Bay Islands""), and large numbers of fur seals (<i>Arctocephalus forsteri</i>).",http://www.doc.govt.nz/upload/documents/science-and-technical/Sfc057.pdf
Open Bay Islands gecko,Apr 2007,Internet - see Notes,,,,"Taumaka is the only known location for three critically endangered species: the Open Bay Islands leech, the Open Bay Islands gecko, and the Open Bay Islands skink . . .",http://www.westmarine.org.nz/documents/WCMarineandCoastalEnvironment.pdf
Open Bay Islands skink,May 2004,Internet - see Notes,Tony Whitaker and John Lyall,,,"An undescribed taxon with unresolved relationships. .. This clearly requires furtherinvestigation as it would be hard to find two more disparate species withinOligosoma than the Open Bay Islands skink and the scree skink.not just inform, but also in habitat and behaviour.",http://doc.govt.nz/upload/documents/science-and-technical/WClizards.pdf Conservation of lizards in WestCoast/Tai Poutini ConservancyTony Whitaker and John LyallPub by DOC Wellington May 2004
Open Bay Islands skink,2000,Internet - see Notes,"Miller, Daugherty",,,"The allozyme data revealed the existence of three undescribed taxa, whichwe have labelled: O. ""Big Bay"", O. "" Grey Valley"" and O . "" Open Bay Islands"". O.""Open Bay Islands"" remains undescribed due to a lack of collected materialfrom this species. The other two species are being formally described in apaper to be submitted to the New Zealand Journal of Zoology.","http://www.conservation.gen.nz/upload/documents/science-and-technical/casn291.pdf Identification of genetic diversity Conservation Advisory Science Notes No. 291 ,Department of Conservation, Wellington.for lizard conservationMiller, C.; Daugherty, C.H., 2000."
open boundary,1990,Among the High Hills of Canterbury,GIBSON,70,,Open boundaries on the stations always allowed a few stragglers belonging to other sheep stations to change territories.,
open bush,1911,TrNZI,,43/204,,This is a small plant ... probably not uncommon in open bush and scrub throughout.,
open camp,"Jun 8, 1994",NZ Farmer,,13,,"Through the Waioeka Gorge, which was much narrower than today, occasionally an 'open camp' was necessary.",
open camp,1996,On the Road Again,PULLEN,45,,"We open camped again in the river bed, this time at Awatere river.",
open camp,1996,On the Road Again,PULLEN,49,,At one camp (we were open camping all the way) we put up the scrims.,
open camp,1996,On the Road Again,PULLEN,61,,"At the Maunganuku Bridge, we open camped and in the morning Bill found we were short of 86 cattle.",
open cast,1935,Gold Mining Year Book,BLYTH,11,,Open cast or cut: Any working or excavation opened from the surface having no roof.,
open country,1841,NZ Journal,,2/48/286,,There is much open or fern country,(G. Cutfield)
open country,1864,Handbook of New Zealand,W GANN & Co,95,,In the ... South Island there is a large and magnificent area of `open country'. [F.N.] I include in this term all tracts and districts which are not true or dense forest districts.,
open country,1871,TrNZI,,4/73,,"In the term `open' I include plains and hill-sides in the low-lands covered with grass, fern, tutu, .... spaniards, wild Irishman and snow grasses.",Haast
open country,1874,Crusts: a settler's fare due south,KENNAWAY,11,,"After crossing the steep range s which I have names as forming a rugged barrier between the harbour and the open country, we struggled up ... to the banks of the river.",
open country,1899,In the Shadow of the Bush,BELL,10,,"His father, who owned a large farm ... in the open country, some fifty miles nearer the coast, had ... started him in life on his own account here in the bush, by purchasing this property of about five hundred acres, ...",
open country,1882,Brighter Britain,HAY,81,,see quot. BUSH n. 4a] <i>Ibid.</i> open land [see quot BUSHLAND],
open country,1950,Farm & Station Verse,WOODHOUSE,,,"Down the slopes we rushed them [sc. cattle] hell for leather,/ Towards the open country and the yard.",1938 E.C. Studholme `Cattle Mustering' in 1950 Woodhouse Farm and Station Verse [p?]
Open Country,1976,Mostly a Farmer,WATERS,63,,"I have often listened to Jim Henderson's radio progamme ""Open Country"", thinking that so many of the stories could so easily fit into a book such as this.",
open country,"Mar 14, 1843",New Zealand Colonist & Port Nicholson Advertiser,,2,,.. the number of sheep or cattle that may be fed on 100 acres of open country.,
open country,1875,Adventuring in Maoriland in the Seventies,MEREDITH,42,,New Zealand appears to be either open country or dense bush.,(1935)
open country,1899,In the Shadow of the Bush,BELL,10,,His father who owned a large farm .. in the open country .. started him in life on his own account here in the bush.,
open country,1989,Empire of the Dairy Farmers,YEREX,32,,The open country which existed - much of it the result of extensive burning-off by the Maori - had been quickly taken up during the 1840s and 50s.,
open country,1996,Farming Progress in NZ 1814-1995,WASWO,8,,"The inner history of the bush settlements is one of hardship, isolation and privation unknown to the settlers of the open country ...",
open country,"Jul 16, 1842",New Zealand Gazette & Wellington Spectator,,3,,"Our road lay through the bush for a mile, when we came into an open country again.",
open country,1919,Breeding and Training of Sheep Dogs,LILICO,19,,"In training to run on the blind, open country without fences or landmarks of any kind should be chosen ...",
open country,1987,"Shepherd's Year,  A",HALL,27,,The blocks of fenced paddocks would end eventually and the wethers would be in open country with no fences to keep them in.,
open country,"Jul 17, 1928",Otautau Standard & Wallace County Chronicle,,1,,"In the early '70s in common with the custom of that time, Mr McLeish possessed a number of head of cattle which roamed freely over the open country. The Provincial Government passed a law that no one could allow cattle to run on the ridges, and Mr McLeish bought a 100 acre farm owned by Mr John Wilson at the Aparima estuary.",No fences.
open country,1956,Farms & Stations of NZ Vol I,TAIT,51,,"To avoid boxing mobs, the ewes and docked lambs were held in open country until dark.",
open country,1966,"Boss's Story, The",NEWTON,39,,... they had to be held on a fenced block - until such time as there was a sufficiently permanent winter snow boundary to enable them to be turned out on open country with comparative safety.,
open country,1948,"Run, Estate and Farm",SCOTTER,7,,In April 1853 .. he bought 820 sheep in Nelson and drove them to Canterbury in search of land and it was only after he saw that all the open country was taken up .. that he .. decided to cross the Waitaki River.,
open country,1948,"Run, Estate and Farm",SCOTTER,15,,"Each year, therefore, those who wished to graze stock on this open country applied for a depasturing licence.",
open country,1964,Deer Shooting Days,THOMSON,102,,In open country such as the high snow grass tops above the bush line ...,
open country,1966,You'll Learn No Harm from the Hills,MCCONOCHIE,65,,"This build-up of hinds brought in during the rut a greater number of mature stags, with the result that animals of better type were to be found in the forest than on the open country of the snow tops.",
open country,"Dec 14, 1988",NZ Farmer,,31,,High open country with plenty of wind also reduces the likelihood of excessive moisture and fleece rot.,
open country,1987,Country Diary,SALE,110,,"Only one house is in sight - about a kilometre away - and the rest is open country filled, it seems, with skylarks.",
open country,1996,On the Road Again,PULLEN,10,,"We gave the other drovers a few days help when they had to go through open country, which can mean going through big stations or just overland away from the main roads.",
open,1898,Contributions to the Early History of New Zealand,HOCKEN,78,,"The prices varied according to the character of the land, whether clear or open, or hilly and wooded. Thus, for fifty-acre sections, the price [for cutting] ranged from 8d. to 1s.9d. per acre, ...",
open,1948,"Run, Estate and Farm",SCOTTER,1,,"In April, 1853, six months after his arrival in New Zealand, he bought 820 sheep in Nelson and drove them to Canterbury in search of land and it was only after he saw that all the open country was taken up ... that he ... decided to cross the Waitaki River. <i>Ibid.</i> 15 Yet, until the land was fenced stock had to be herded. There was also the unsold land open for grazing. Each year, therefore, those who wished to graze stock on this open country applied for a depasturing licence - ..",
Open,"Nov 15, 1983",NZ Journal of Agriculture,,20,,"Open- The senior or top class of dog trial competition. You can only call yourself an 'open man/woman', if you've won an open and your dog an 'open dog' if it's won an open.",
open farm,"Jan 24, 2002",Opunake and Coastal News,,16,,"An open farm will be held on Thursday January 24, between 1:00 and 2:00 pm.",
open farm,Jun 1995,NZ Dairy Exporter,,75,,Open farm: organic farmers Jamie and Cath Tait-Jamieson lay everything on the line for visitors to the partnership farm at Palmerston North.,
open farm,"Dec 7, 2000",Taranaki Daily News,,20,,"Auction, Open Farm Today..to be auctioned on site Friday 26 January 2001. 11:30 am (if not sold prior).. Rama Road Open Farm Today..Located just below the Skeet Road ...",
open farm,"Oct 17, 2001",Taranaki Daily News,,19,,"Auction - Palmer Road, Kapuni, Open Farm today. Has own wintering pad.",
open farm,"Oct 27, 2001",Taranaki Daily News,,38,,"This 92 ha property has a near new 24 aside H/B cowshed, it is centrally raced and well fenced. Open farm Thurs 1 Nov.",
open farm,Nov 2001,Manawatu Evening Standard & Property Guide,,56,,Open farm dates: Wednesday 7th Nov at 2.30 pm.,
open farm,"Dec 7, 2000",Taranaki Daily News,,20,,"Auction, Open Farm Today.. to be auctioned on site Friday 26 January 2001 11:30 am (if not sold prior).. Rama Road Open Farm Today.. Located just below the Skeet Road.",
open farm,"Feb 22, 2001",Taranaki Daily News,,20,,240 cow dairy farm - Open Farm tomorrow.,
open land,"Oct 6, 1880",Hawera Star,,2,,.. free selection in bush country would be much more difficult to carry out than it would be in open land.,
open land,"Aug 8, 1845",Nelson Examiner and New Zealand Chronicle,,90,,"This would give to each race the species of country most adapted to it and already in its possession; the forests of the Northern Island to the Maori, the sheep pastures and arable open land of the Wairarapa, the Wairau, Port Cooper, Otago, and the rest of this island to the Europeans.",
open land,1860,"Otago, New Zealand",CARGILL,29,,Open land is covered with either fern or grass..and is easily brought in.,
open land,"Sep 13, 1905",Bay of Plenty Times,,2,,"It is reported that 27,000 acres of bush, forest and open land, at Manawahe, between Rotorua and the East Coast, will shortly be thrown open for selection.",
open land,"Jan 11, 1845",Nelson Examiner and New Zealand Chronicle,,178,,"He describes the valley through which the river runs to be twenty miles wide, finely wooded, with some open land.",
open land,"May 4, 1844",Nelson Examiner and New Zealand Chronicle,,35,,"The improved scheme of the Nelson settlement, and the circumstance of our having more open land in the neighbourhood of the town, has relieved <i>us</i>, in his opinion, from one of these evils, and mitigated the extent of the other.",
open land,"Jul 24, 1880",Hawera Star,,2,,"Doubtless, many of our readers would be glad to hear the official valuation of the open lands on the Plains.",
open land,"Jul 17, 1883",Hawera Star,,2,,Enquiries are constantly being made through the local commission agents for farms of open land in the district.,
open one's lunchbox,1988,"Dictionary of Kiwi Slang, A",McGILL,70,,"lunch box bum, in phr. open your lunch box, to fart, aka drop your lunch box. NZA.",
open out,1988,"Dictionary of Kiwi Slang, A",McGILL,79,,"open out behaving badly, as in Frank S. Anthony's Me and Gus.",
open out,1981,Loughnan Glossary,LOUGHNAN,57,,"Whereas a machine shearer breaks out up the neck, a blade shearer opens out. Especially with the wrinkly-necked Merinos, to open out with blades can easily produce bootlaces.",
open sanctuary,Aug 2003,Auckland Naturally,,3,,The Waitakere Branch of Forest and Bird has a partnership with the Auckland Regional Council to create the Ark in the Park open sanctuary in the Cascades Kauri Park.,
open sanctuary,Jul 2007,NZ Geographic,,86/79,,"It is New Zealand's first open sanctuary, ""open"" because you don't need a special permit to go there. The sanctuary is the result of a partnership between ARC and a large group of 400 or so volunteers known as the Tawharanui Open Sanctuary Society Incorporated (TOSSI).",
open scrubland,1935,Handbook Arthur Pass National Park,ODELL,95,,"Two scrub associations are found on the old river terraces, one, the bane of the bare legged travellers, open scrubland ...",
open shearing,1955,Wool Away!,BOWEN,76,,"On good open shearing, when the grease is up, and the comb enters easily, give the comb a lead on the cutter of one-eighth of an inch, ...",
open shearing,"Nov 22, 2001",Hawke's Bay Today,,18,,Open shearing wanted by reliable gang.,
open shed,1965,High Endeavour,VANCE,51,,Sometimes shearers had to ford flooded rivers so as to be at an 'open shed' station on time. 'Open shed' stations picked their shearers from those present when the shed opened; there were no prior engagements and no jobs for latecomers.,
open shed,1981,Loughnan Glossary,LOUGHNAN,II 2,,"open shed: as distinct from a closed shed, this was one in which shearers used to be chosen from amongst those who were there in time when the annual shearing began.",
open shed,"Oct 28, 1876",North Otago Times,,3,,"Shearing will commence at Benmore Station, on Friday, 11th November. An Open Shed.",
open shed,"Dec 3, 1872",Hawke's Bay Herald,,1,,"Shearers wanted at Messrs, A and W Birch's, Oruamatua, Kereru. To commence on the 9th December. Open shed.",
open shed,1973,Big Country of the South Island,NEWTON,154,,"Another feature, which is unusual in a property of this size, is that this is an open shed - the shearers, all local men, just seem to be avilable when required.",
open shed,1990,"Forgotten Worker, The",MARTIN,37,,C G Tripp's Orari Gorge station in South Canterbury ... was a well-known open shed.,
open shed,1872,"Xmas Cake in Four Quarters, A",BARKER,Ch. III,,"Brown and Wetherby's was an `open shed', where any shearers that came were taken on until there were hands enough.",
open shed,"Jan 27, 1934","Press, The",,15,,"Open shed.-S. where the shearers are not engaged beforehand, but roll up on the advertised day and take their chance of employment. I think the custom has quite gone out of use now. Anama in the late 'nineties was the last station I can remember to have seen advertising its starting day.",
open shed,1946,Early Canterbury Runs,ACLAND,166,,"Clayton was an `open shed', that is, the shearers were not engaged beforehand, but turned up and took their chance of a pen on the advertised starting day.",
open shed,1979,Stations,TEMPLE,93,,It's the last year Ben Griam's an open shed. Those picked this year can book their place for next.,
open shed,"Oct 11, 1986",Radio NZ / National Radio,,,,"`Do you have open shed or contract shearing?' `I prefer the contract gang, but you have to help your local shearers; some wives are on the table, and we're often on the board too.'",National Radio Landline Farming Programme
open shingle,"Apr 11, 1968",NZ Farmer,,45,,The 'Lake' country is mainly open shingle and it's mostly topside work - slewing sheep downhill.,
open shingle,1949,High Country Days,NEWTON,187,,"He had a clean-working free-running dog, more suited to open shingle country.",
open shingle,"Mar 23, 1967",NZ Farmer,,35,,The country above me was a great open shingle face ...,
open slather,"Jul 1, 2003",Independent Herald (Wellington),,1,,"However, Wellington Central MP and ACT New Zealand justice spokesperson Stephen Franks says in practice council's [<i>sic</i>]will have to pass special new by-laws, and until they do it is ""open slather"".",
open slather,"Jul 15, 1915",Poverty Bay Herald,,8,,"It was our fate to witness the misfortune of the sinking of the Triumph near by, and when next morning the Majestic followed it made us want still more to 'Up and at them'. However, things will not and cannot be always in our favor, but it [is] hard to grin and bear it at times, especially when your side loses without a fair go, or what we call 'an open slather'.",from a letter from Gunner Pat Duncan at Gallipoli to a friend in Gisborne
open slather,1949,Journey Towards Christmas,"Llewellyn, S.P.",51,,"The petrol was discovered about six miles down the Amyntaion-Servia road and as soon as the lorries were loaded our drivers turned their attention to the ration section of the dump. They were shown where the luxuries were stacked and told to help themselves. It was their first experience of what was to be known later as an 'open slather' and many of them were pink with excitement as they scrambled among the stacks, breaking open cases of tinned fruit, tinned vegetables, pickles, jam, tobacco, cigarettes. You just helped yourself. It was a childhood dream come true and for a quarter of an hour they behaved like greedy small boys. They stuffed their blouses with tins and threw cases on top of the loads of petrol.Often, in the days that lay ahead, we were to be wet and cold, sick and sorry, tired and frightened-never hungry. Empty and half-empty tins of peas and beans and pears and raspberries were to mark the passage of our convoys. It is probably fair to say that from the day of the first 'open slather' until the day we left Greece most of us over-ate.",
open slather,"Dec 6, 1924",NZ Truth,,5,,"It is open season all the year round for the shooting of bank clerks. Even the wild ducks get a sanctuary sometimes, but with the underpaid and responsibility-laden banker it is an open slather all the year round.",Truth's 'Melbourne Rep.' is reporting on a spate of bank shootings there
open slather,"Jan 3, 1929",NZ Truth,,8,,"The last round was a 'trimmer'. Both boys let themselves go, and made it an open slather. The crowd was on its feet throughout.",
open slather,"Feb 13, 2004",Dominion Post,,A3,,If the poachers know all they have to be is staunch ... then it's open slather.,
open slather,"Oct 11, 1920",Grey River Argus,,3,,Open Competition (heading) In the final of the open 'slather' Dellaway gained the verdict over Parker on the towel trick [?].,
open slather,"Mar 26, 1918",Grey River Argus,,4,,I think his [a boxer named Torrie's] will be one of the best professional fights the Association has ever put on and it will be open slather from the gong. I am sure this event will be worth the price of admission.,
open slather,1964,Bell Call,ASHTON-WARNER,77,,"Aren't you supposed to have anything at all if her kids can't have it? Or are you supposed to give them open slather, baby and all? Right, left and center [sic] ?",
open slather,1988,"Dictionary of Kiwi Slang, A",McGILL,79,,"<i>open slather </i>unconstrained and often riotous gathering available to allcomers; possibly from Irish `slighe', access; eg `It's open slather, I hear, at the golf clubrooms this Saturday. Coming?' NZA.",the suggested etymology is erroneous; see slather n.
open slather,"Sep 27, 1932",Evening Post,,10,,"There was an acrimonious discussion, and reference to an ""open slather.""",
open slather,"Feb 24, 1944",Evening Post,,4,,"This bliss had not lasted more than a week, however, when we were informed that the ""increased"" charge of 4d had been disallowed by the Price Tribunal, and that the price would again be 3 1/2d, with open slather as to weight.",
open the books,"Oct 6, 1993",Dominion,,2,,[Caption] Finance Minister RuthRichardson opens the books.,
open the books,"Oct 5, 1993",Evening Post,,2,,"""This decision.. completely erodes theaccuracy of anything the Governmentchooses to present tomorrow,"" he said inreference to Finance Minister RuthRichardson's intention to ""open thebooks"" and explain the state of thecountry's finances.",
open the books,"Oct 8, 1993",Dominion,,7,,"In the next three years, so the story inthe open book goes, unemployment ""willremain around current levels.""",
open the books,"Nov 1, 1986",Dominion,,5,,"The National Party opened its books to the writer, and made available its records and files.",
open the books,1987,"Politicians, Public Servants & Public Enterprise",ROBERTS,118,,"The document was released as part of the pledge by the new Labour] Government to `open thebooks'. [footnoted to a reference to R.O. Douglas's Preface to Economic Management, The Treasury, 1984: p. 111]",
open the books,"Aug 29, 1998",Listener (New Zealand Listener),,21,,The advice I'm giving Jenny Shipley is to open the books. She has to be frank and point out just how revckless Mr Peters has been.,
open the books,"Jul 11, 1984",Evening Post,,60,,Labour.. cannot release such detail until Labour has seen the books and the IMF report has been one of the books Labour has been demanding to be opened.,
open the books,"Jan 24, 1860",Daily Southern Cross,,2,,"Of late, however, in consequence of the blustering abuse with which we have been assailed, we have paid some attention to the Exodus, having made enquiry of shipping agents, who have obligingly opened their books to us.",
open the books,"Jun 13, 1878",Timaru Herald,,4,,"Why, if this were consistent, the ignorant public might start up and suggest that the New Zealand Parliament should cause Banks to open their books to legalised auditors, and pry into overdrafts, &c, &c, of a few founders, who have become practical millionaires thereby, in their own accounts, or perhaps require a set of directors to be ineligible for re-election, or under restriction, so as not to be playing the game of "" one out the other come in "" in rotation, for such a state of things would play "" old gooseberry "" with the manipulation of assets.",
open up,1902,"Settler's Handbook of NZ, The",,11,,"This industry gives employment to a large number of persons, both directly to those engaged in breeding, shearing, freezing, and shipping, and indirectly to those who labour at bushfelling, grass-seed sowing, fencing, and otherwise opening up new country.",
open up,1905,Sons o' Men,LANCASTER,81,,A big Maori was making the [shearing] pace; opening up in a scientific fashion with a clean-run cut over the ear-root,
open up,1981,Sunrise,,45,,"... he leaned well over the sheep, placed the forelegs under his left arm, and opened up the right side of the belly with a few deft strokes.",
open up,1989,NZ English Newsletter,,3/26,,open up: To shear wool from a certain area. An example is to `open up the neck'.,Wallace Shearing Glossary
open up,"May 17, 1951",Personal Communication,,,,"Pelters open up (that is, slit guts) and if not careful they cut the paunch and .us;grass goes all over the place.",Feilding Freezing Works terms p.c. Colin Gordon
open up,1887,Handbook NZ Mines,PYKE,11,,Other gullies and beaches further up the river were shortly afterwards opened up.,1863 V. Pyke's Report in 1887 Handbook NZ Mines
