Head Word,Date,Source,Author,Vol / Page,Edition,Quote,Notes
old lag(ger),Oct 1999,NZWords,,2(2): 1,,"Inmate terms include <i>old lag, old lagger</i> (someone who has been in and out of prison for years) and <i>baby lagger</i> or <i>first lagger</i> (someone serving their first prison term - usually a short one).",
Old Land,1935,"Little Country, The",Brodie,1,,"... which they call the Old Country, the Old Land, the Old Dart, and, in common speech, Home.",
Old Land,1959,NZ English (Wall),WALL,7-8,3rd,"While a large number of people, born and bred in New Zealand, speak English as correctly and with as pure an accent as the best speakers in the Old Land, these persons are not a numerical majority.",
old maid,"Aug 31, 1963",Evening Post,,31,,"[Wellington Fishing Col.] Sometimes the catch would include ... the odd unlucky crayfish or several fat kelp-fish, known locally [on Wellington's east coast] as `old maid'.",
old maid,"Jul 23, 1986",Codes for Species in NZ Waters,,,,"[species name] parore .. [scientific name] <i>Girella tricuspidata</i> .. [other name(s)] black bream, blackfish, black snapper, old maids, mangrove fish, pacific bream",
old man,1917,New Zealand At the Front,,106,,"`Murder on the old sergeant-major, and the bottom line goes for the old man.'",
old man,"Aug 10, 1921",Quick March,,27,,"`Come on me lucky lads, you pick 'em. Hop in, digs, and have a fly with the old man. Come on, thick and heavy, for I'm here today and gone tomorrow.'",
old man,"Oct 1, 1918",Quick March,,3,,"Diggers' Rules of Crown and Anchor. - When the limit is laid on the spade, club, heart, diamond, and anchor, and the banker throws three crowns, he shall forthwith cry in a loud, clear voice : `The old man smiles again,' and folding his tent like the Arabs, silently beat it.",
Old Man Bottom,1908,NZ Geol. Survey Bulletin,,No 6 (N.S.)/113,,In Westland these ancient gravels [Montere Gravels] form the true Old Man Bottom of the gold-miners.,"Morgan, Mikonui"
Old Man Bottom,1938,NZ Geol. Memoir,,No 4/49,,"... it was shown that it is posisble to differentiate between a lead formed of less consolidated gravels, if imbedded in more consolidated gravel,locally known as `Old Man' bottom. [Westland]",Modriniak and Marsden
Old Man Bottom,"Oct 28, 1892",Grey River Argus,,2,,"An old Bendigo miner, who worked in this very locality in 65, says that the ""old man"" bottom was followed right down as far as the flat, the wash giving out at that point.",
old man couch,1926,Weeds of New Zealand,HILGENDROF,49,1967,"TWITCH (<i>Agropyron repens</i>) is sometimes called couch, and [also] blue, English, white, or old man, twitches or couch. It is one of the worst twitch of arable land and gardens.",
old man couch,1969,Standard Common Names for Weeds,,54,,<i>old man couch [=] couch [s] </i>,
old man,1870,Adventuring in Maoriland in the Seventies,MEREDITH,97,,"(Letters, (ed) Harrop 1935) [check this] We found the boar well protected in the rear by an overhanging `old-man fern'.",
old man,1896,Pioneer Work in the Alps of NZ,,134,,... I feel confident that any one who has seen a Westland river in an `old man' flood would credit the actual upheaval of any sized boulder.,
old man,1898,Austral English,MORRIS,328,,"Old Man, adj large, or bigger than usual. Compare the next two words. [1845]",
old man,1966,In the Lee of the Hokonuis,BARRY,149,,The `old man' Rimu that took five hundred or more years to grow is laid low in the space of a few minutes by the woodmen's axe.,1926 Prospectus of the Waitane Saw-milling and Afforestation Ltd in 1966 Barry In the Lee of the Hokonuis
old man,1929,Whitcombe's Etym. Dict. Aust-NZ Suppl.,,8,,"old man a.-old' man n. a full-grown male kangaroo; hence, old'-man a. unusually large; of goodsize.",
old man,1930,Bushman Burke,DEVANNY,9,,Old Man rata. <i>Ibid.</i> -17 [He] had oncetaken to an Old Man pig with a slasher.,
old man,"Nov 11, 1933","Press, The",,15,,"Old man.- Slang. Striking, big, remarkable, e.g. an o.m. rock, flood, nor'-wester, cabbage tree, etc. Hence the o.m is a common name for paddocks, though some hills are probably so called from the fancied resemblance to man's face. (C.)",Acland Glossary
old man,1938,Nor the Years Condemn,HYDE,144,,"You've got to be cunning as a fish; there's nothing to look for but a little bump in the mud, and that's old man flounder.",
old man,1938,Nor the Years Condemn,HYDE,253,,Old Man Blackberry Farm,
old man,"Jan 31, 1951",Evening Post,,4,,... an `Old Man' southerly.,
old man,1979,Collected Poems,BAXTER,241,(1953-61),"A cord of old man manuka,/ I cut in a day. <i>Ibid.</i> 277 Standing above the clump of old man manuka",
old man,1964,Bell Call,ASHTON-WARNER,63,,He appears across the playground beneath the Old Man Totara.,
old man,1988,"Dictionary of Kiwi Slang, A",McGILL,79,,old man a rural object of striking or large appearance; eg old man paddock or old man rock. NZA.,
old man,1896,AJHR,,D.-4/244,,"Whenever you touch hills, there you are on ""Old man"".",
old man,1988,"Dictionary of Kiwi Slang, A",MCGILL,79,,old man: a rural object of striking or large appearance; eg old man paddock or old man rock.,
old man,1875,Adventuring in Maoriland in the Seventies,MEREDITH,97,,We found the boar well protected in the rear by an overhanging 'old-man fern' ...,
old man,"Feb 20, 1930",NZ Dairy Exporter,,37,,"First floods, and then an 'old man nor'wester.'",
old man,1981,Loughnan Glossary,LOUGHNAN,57,,"old man: a kind of extra-superlative adverbial or adjectival phrase, often used to describe something particularly pestilential or annoying ( eg old-man couch grass or a real old-man nor'wester but it can also indicate something of great age (an old man totara).",
old man,1988,From the Hills With Vision,WILSON,32,,'Old man' scrub like this probably took over after fertility depletion of country which could not hold vigorous pasture ... [old-man],
old man flood,1933,NZ Alpine Journal,,V/20/180,,Experiencing a real `old man' flood ...,
old man flood,1939,First White Boy Born in Otago,BEATTIE,173,,This was the famous Old Man Flood [of the Shotover in 1863]; it was the biggest I ever knew ...,
old man flood,1943,Pure Gold,HISLOP,19,,"It was in 1878 that the Old man flood, as [the Otago miners] called it, happened and swept all the bridges away between Cromwell and Balclutha.",
old man flood,1947,Early Runholding in Otago,BEATTIE,61,,"The `Old Man Flood' of 1863 on the Shotover, Arrow, Kawarau, and Clutha rivers is said to have drowned many diggers, ...",
old man flood,1969,From Forest to Farm,MOORE,45,,... but a real `old man' flood in the autumn ultimately swept the tangle away and cleared the bed of the stream.,
old man flood,"Jun 26, 1905",Evening Post,,5,,"The town has had the ""Old Man Flood,"" the ""Jubilee Flood,"" the ""Record Reign Flood,"" but none of them equaled the one that swept the town yesterday.",
old man flood,"Aug 14, 1912",Grey River Argus,,6,,"Then, with the aid of practical engineering talent they could have made a straight cut for the Grey River from Jerusalem point to the beach direct through Coal Creek Flat and the gorge and as straight out to sea as circumstances would permit, the spoil meanwhile being utilized to reclaim all the river frontage on the north side to a height sufficient to defy the biggest ""old man flood"" ever knwn [sic] and every cubic foot of which would by now have been of immense value.",
old man flood,"Aug 10, 1885",Grey River Argus,,2,,"Under the most unfavourable circumstances, the upper portion of the line is not likely to give any trouble, but it is quite possible and not at all unlikely that the lower part may be submerged for a few hours during heavy floods; but it will be more than ordinary, or an ""old man"" flood that will do this.",
old man flood,"Jul 28, 1923",NZ Truth,,9,,"The ""old man"" flood which threatened Hawkes Bay last week has, like Massey's ""State Advances Bill"", passed safely and the week of anxiety now over, the people are ready, ""aye ready!"" to discuss the ways and means of BRINGING ABOUT THE DOWNFALL of the great Wellingtonians.",
old man flood,"Oct 5, 1878",Evening Post,,2,,"The Shotover River was fully ten feet higher than during the ""old man"" flood.",
old man flood,"Jul 6, 1866",Otago Witness,,3,,"That fickle stream, the Molyneux, rose to a great height, and a second ""Old Man"" flood was expected.",
old man gorse,"Oct 2, 1950",NZ Dairy Exporter,,42,,"In the case of 'old man' gorse, Mr Brodie recommended burning ...",
old man gorse,"Sep 1, 1951",NZ Dairy Exporter,,29,,"Trials have shown generally poor control with 2,45-T formulations applied to 'old man' gorse ...",
old man gorse,"Sep 1, 1951",NZ Dairy Exporter,,31,,'Old man' gorse eradication presented no problem where land could be cultivated either by the plough or giant discs ...,
old man gorse,"Sep 27, 1951",NZ Farmer,,12,,"Now, however, a bulldozer makes much easier the initial task of grubbing out the 'old man' gorse.",
old man gorse,Mar 1987,NZ Dairy Exporter,,25,,Gorse is from the small to genuine 'old man' stuff.,
old man gorse,1992,Home from the Hill,ADDENBROOKE,102,,I trapped several patches of bush on different farms as well as patches of heavy old-man gorse. [old-man gorse],
old man gravel,1981,Paparoas Guide,DENNIS,139,,"Great thicknesses of these sediments were laid down ..., some two thousand metres of them still lie beneath the Old Man Gravels of the Grey River valley. ... More recent and perhaps better known are the Pliocene Old Man Gravels of the Grey-Inangahua Valley, a conglomerate that is part of the large [140] sheets of aggradation gravels deposited both east and west of the ... Southern Alps early in the Kaikoura Orogeny.",
old man gravel,"Jul 5, 1916",Grey River Argus,,1,,"Tunnels 6ft by 5ft in ""Old Man"" gravel, ""Tapa,"" and soft sandstone.",
old man gravel,1982,"Brief History of Gold Mining, A",EASTWOOD,135,,"There were both a sandstone bottom and a blue-pug bottom on top of what they called ""hard old-man"" gravels.",
old man gravel,1990,Tramping in South Island Forest Parks,,121,,Erosion of rocks overlying the granite produced thick mantles of gravel in the form of a 'piedmont plain'; the series of low hills between Ikamatua and Reefton Saddle are the only remnants of this plain and are called the 'Old man' and 'Moutere' gravels.,
old man gravel,"Feb 27, 1901",Otago Witness,,21,,"A little gold in the surface drift, fair dredging prospects in the wash, the richest gravels being on the bottom; total depth, 12ft 6in; bottom, the soft sandstone of the Old Man gravels.",
old man nor'-wester,1959,"Gun in My Hand, A",SLATTER,190,,"And the nor'-westers in summer, the Old Man Nor'-Westers, blowing through a great arch over the Alps, ...",
old man reef,1894,Report on the Older Auriferous Drifts of C.Otago,McKAY (1897),48,,"It seems to be confined to acomparatively narrow run, which is at aconsiderable angle against the "" Maoribottom,"" or ""Old man reef.""",
old man snapper,"Oct 27, 1892",Otago Witness,,28,,"Calculus is a fine upstanding son of Trenton and Rosemary, with the most pronounced Roman nose I have ever seen an animal display; in fact it forcibly put me in mind of an old man schnapper.",
old man snapper,1956,NZ Fishes: An Identification Guide,GRAHAM,245,,"Many large Snapper are caught with a peculiar hump on the head which is caused by a thickening of the frontal bone. When a fisherman lands such a fish he immediately states: `I've caught an old man Snapper' under the erroneous impression it is an old male fish. I have often dissected these `old man' Snappers and found that there were as many female as male fish with this conspicuous bony knob. The name `old man Snapper' comes from the likeness to the face of an old man with bulbous red nose, a short clipped moustache and tight upper lip, which can be seen in the illustration.",
old man snapper,1981,Fisherman's Bible,WILSON,227,,"`Old man snapper' are those fish which develop a hump on top of the head as they become older; often the fleshy upper lip also increases in size. This condition may affect females as well as males. The term `old man may also be applied to old, slabby fish in poor condition, whether they have developed a hump or not.",
old man snapper,Feb 1981,Avondale College Slang Words in Use,,,,<i>old man snapper </i>,(Goldie Brown Collection)
old man twitch,1926,Weeds of New Zealand,HILGENDORF,49,1967,"TWITCH (<i>Agropyron repens</i>) is sometimes called couch, and [also] blue, English, white, or old man, twitches or couch. It is one of the worst twitch of arable land and gardens.",
old man twitch,May 1950,NZ Journal of Agriculture,,381/1,,,
old man twitch,1969,Standard Common Names for Weeds,,54,,old man twitch [=] couch [s],
old man's beard,1879,Geology of the Provinces of Canterbury & Westland,HAAST,109,,... the beech forest ... now had become dwarfish and covered with <i>Usnea barbata</i> (that peculiar pendant greenish white lichen) ...],
old man's beard,1888,Antipodean Notes,D'AVIGDOR,152,,"... from the branches hang bunches of that wonderful lichen, `old man's beard', and slender lance-wood emerges ... from the convolvulus-leaved but thorny `lawyers' and the low manuca scrub.",
old man's beard,1893,TrNZI,,25/316,,"Of these are some of our larger ... tree-lichens, such as ... <i>Usnea barbata</i>, Fries (`old man's beard'), several varieties.",
old man's beard,1927,Birds of New Zealand,GUTHRIE-SMITH,144,,"... the pendent `old man's [145] beard' that, yards in length, swings from the tawa boughs.",
old man's beard,1956,NZ Journal,WILLIAMS,117,,"[when the rimu] tree becomes old these splendid leafs [sic] become smaller and grow in tufts ... giving it the appearance of being dead, or `covered with old Mauries beards' rather than natural leafs. [Editor's Note 10, p. 117 says: Usually [sic] known as Old Man's Beard, a lichen (<i>Usnea</i>).]",
old man's beard,1961,Flora NZ,MARTIN,"51, fig. 120",1929,"Foliaceous Lichens - mainly <i>Sticta fossulata</i>, and tufts of Old Man's Beard (<i>Usnea</i>), on dead tree branches in Stewart Island forest",
old man's beard,"Oct 9, 1982","Press, The",,15,,"Recent reports about the threat posed to some North Island bush by an invasive exotic clematis confused some people, says a reader, because the popular name, `old man's beard,' applied to the clematis has also been applied to a native lichen.",
old man's beard,1982,Stewart Island Plants,WILSON,486,,"<i>Sphaerophorus tener Vegetable wool</i> ... Woolly clumps of intricately branching, fine white stems, sometimes stained pale pink. ... It can look similar to OLD MAN'S BEARD LICHENS, <i>Usnea</i> spp., which drape dead branches, shrubs and rocks.",
old man's beard,"Mar 5, 2002",Independent Herald (Wellington),,17,,"Old man's beard is a member of the clematis family, and was introduced from Europe as a decorative plant... ""This is a good time to look out for old man's beard. It tends to spill out of hedges at this time of year, or you might see it flowering in the tops of trees or along roadsides.""",
old man's beard,"May 12, 1995",Listener (New Zealand Listener),,64,,"Waving his hands about like David Bellamy stumbling unexpectedly upon a fresh crop of old man's beard, he passes on a fresh secret of business success.",
old man's beard,1979,Heinemann NZ Dictionary,,746,,"a wild clematis in its winter form, clothing hedgerows.",
old man's beard,1981,Weeds of Roadsides,TAYLOR,149,,"TRAVELLER'S JOY (<i>Clematis vitalba</i>) ... In autumn dense down takes the place of flowers . . ., giving the alternative name `old man's beard'. ... Traveller's joy was introduced from Europe but extends into native forest.",
old man's beard,"May 8, 1984",Karori and Western Suburbs News,,8,,"The fast-growing introduced vine Old Man's Beard is smothering native bush in many parts of the city and surrounding hills, ... Also known as Clematis vitalba, Traveller's Joy and Mile-a-Minute, the climber spreads rapidly.",
old man's beard,"Sep 13, 1982",Evening Post,5,,,"Old man's beard is raging through native bush and may be stopped only by public concern. -->The Department of Lands and Survey is holding an old man's beard seminar in Wellington in November, detailing the widespread destruction the vine has caused in native bush.",
old man's beard,1982,Stewart Island Plants,WILSON,38,,"<i>Clematis vitalba</i> - TRAVELLER'S JOY or OLD MAN'S BEARD - has innumerable, small, creamy white flowers in late summer ...",
old man's beard,"Feb 14, 2004",Dominion Post,,E10,,"This small area is a conservationist's nightmare, with thick infestations of Lonicera japonica (honeysuckle), Passiflora caerulea (blue passionflower) Tradescantia flumenensis (wandering Willie), garlands of Clematis vitalba (old man's beard), patches of hemlock ready to seed and enough nodding thistle (Carduus nutans) to keep Eeyore the donkey gloom-free for weeks.",
old man's beard,"Aug 4, 2000",Evening Post,,18,,The control of noxious weed old man's beard on private property in Wellington is being hailed a success by the regional council.,
old man's beard,"Feb 15, 2003",Listener (New Zealand Listener),,26,,Wellington Regional Council has hunted down old man's beard to the point of coming onto people's properties.,
old man's beard,"Jan 26, 2002",Listener (New Zealand Listener),,12,,Saturday.. was a warm and sunny day for the 28 volunteers (plus nine apologies) who turned up at the Taihape Kindergarten to cut Old Man's Beard on Mt Stewart.,Original in Central District Times 20/10/01
old man's eyebrow,1889,Art Album NZ Flora,FEATON,144,,"DROSERA BINATA (<i>Labill</i>.) ... The `STRAP-LEAVED SUNDEW'.- This very handsome plant is found in bogs and damp places throughout the Islands, and is abundant in Australia and tasmania. ... The plant is popularly known as `Old man's Eye-brow'. [??from the glandular hairs]",
old man's refuge,1889,Kaipara and Waitemata Echo,BARLOW,177,,"The Legislative Council is supposed to correspond with the House of Lords at home, but it is called out here by the irreverent, the Old Man's Refuge.",
old Maori's beard,1844,Journal,WILLIAMS,104,,"[when the rimu] tree becomes old these splendid leafs [sic] become smaller and grow in tufts... giving it the appearance of being dead, or `covered with old Mauries beards' rather than natural leafs. [Editor's Note 10,p. 117 says: usually [sic] known as Old Man's Beard, a lichen(Usnea).",
old mate,1963,NZ Truth,,,,[Pat Rockford's col.] Rangi was trudging along ... when he went his old mate Maka -->nf P.,[?d before July]
old mate,1909,Ballads about Business,THOMPSON,91,,"`Come along with me to Southland,' said my old mate then to me,/ You'll be sure to get some yacker ...'/ I agreed. We packed our blueys, and together then we went/ By train to Invercargill .../",
old men's workings,1900,TrNZI,32/314,,,"At all events, close to Bunny Cliffs, ... there are some `old men's workings', as the remains of what are taken to be ancient surface streaming of the prehistoric races are called.",Colenso Cornish Tin Mines
old money,"Jun 26, 1999",Listener (New Zealand Listener),,30,,"With almost savage timing, the Hortons are talking heads on <i>Old Money</i>, a two-part documentary.. which features interviews with other scions of wealthy New Zealand families.",
old money,Jun 2001,NZ Geographic,,No. 52:26,,"In the understatement you can hear the quiet rustle of Christchurch ""old money.""",
Old Ned,1892,"Big Huey, The",NEWBOLD,252,,OLD NED (n) Head.,
old respectables,1865,Letters,RICHMOND,1/620,,The old respectables (or buffers or codgers as I have heard them called),
old rookie,"Sep 19, 1917",NZEF Chronicles,,63,,"The privit bein' a well seasoned old rookie, sez he wuz perfeckly sober.",
old season,"Nov 13, 2001",Dominion,,20,,Prime sheep: hvy old-season lambs $115 - $130 ...,
old season,"Nov 17, 2001",Dominion,,18,,Store sheep: New-season lambs $70.20 - $76.25 .. old-season lambs $106.,
old season,"Nov 20, 2001",Dominion,,6,,hvy old season lambs $98 - $110 [old-season],
old settler,"Mar 26, 1842",Nelson Examiner and New Zealand Chronicle,,10,,"""We can state, from good authority, that the Land claims Bill will give satisfaction to every reasonable 'old settler,' and will be a boon thankfully accepted by the majority of the land claimants; that means will be taken to expedite the settlement of the claims, with a promptitude almost unknown in the annals of commissions, and thus set at rest a question which has been the source of much irritation and discontent.""",
old settler,"Mar 13, 1875",Daily Southern Cross,,1,,"""Neither have I forgotten the manner in which Sir George Grey represented to the Home Government the actions of the old settlers in their dealings with the natives; and how he accused the settlers of wishing the Govenment to expend blood and treasure in fighting the natives to establish unjust purchases of land which he stigmatized as robbery.""",
old settler,"Feb 15, 1899",Wanganui Chronicle,,2,,An old settler named John Trimmer was found dead at Tologo [sic] Bay.,
old settler,1911,TrNZI,,43/438,,Old settlers will tell you that the seasons have changed of late years.,
old settler,"Jan 7, 1953",NZ Observer,,19,,"They will all ""gang up"" on you if you are not an old settler.",
old settler,"Oct 12, 1844",New Zealand Spectator & Cook's Strait Guardian,,2,,".. he had been an old settler among them, and, as the chairman observed, was for a period the only ordained clergyman in the settlement...",
old settler,"Dec 28, 1904",Wanganui Herald,,7,,The recent enthusiastic gathering of old diggers prompts me to make the suggestion in your columns that the time is now ripe to form an Old Settlers' Association in Wanganui.,
old settler,"Jan 12, 1924",NZ Truth,,10,,"He was only 47 years of age, and was born in New Plymouth, being the son of an old settler.",
old settler,"Dec 23, 1930",Otautau Standard & Wallace County Chronicle,,3,,"Mr Beck considered that the old settlers who took up the original Government sections when the road and crossing were as at present, were not getting justice and it appeared as if the Ohai Railway Board were the only ones considered.",
old settler,"Nov 8, 1842",New Zealand Colonist & Port Nicholson Advertiser,,3,,"Do not .. take him for an old settler, as he would have you suppose. Dr. Martin is one of the late purchasers, but the British Government have no more <i>right</i> to interfere with Dr. Martin's purchase, made before their assumption of authority, than they have to deprive the oldest planter in Jamaica of his patrimonial estate.",
old settler,"Jan 13, 1843",New Zealand Colonist & Port Nicholson Advertiser,,2,,"B-e-<i>yng</i> an Old Settler, you may rely upon my advice.",
old smoke,"Feb 19, 1910",NZ Truth,,243/1/4,,"The London money-lenders handed out 182,500,000 [pounds] in loans to borrowers all over the globe last year. ... No wonder he [Critic] has booked his passage for the Old Smoke, the Mecca of all dead broke pilgrims after cheap beer",
old smoke,"Dec 18, 1902",Wanganui Herald,,2,,"When a fire occurs in the ""Old Smoke"", the Tin Pot is generally on top.",
old stager,1947,Early Runholding in Otago,BEATTIE,41,,Some [cattle] got away in the bush and ran wild ... One old stager shot on the Black Umbrellas bore McKellar's old key brand that had gone out of use nineteen years earlier.,
old stager,1943,Pure Gold,HISLOP,140,,"The big fish I caught ... was very likely one of the old stagers which had come out of the many very deep mining holes on the flat, ...",
old stager,"Jun 3, 1865",Daily Southern Cross,,3,,".. but his rider .. was unable to catch that game old stager Little Dick, whom Mr. Cooper's admirable riding enabled to add one more to the numerous victories he has already achieved in this department.",
old stager,"May 6, 1863",Otago Witness,,6,,"After some further desultory discussion, the meeting was called to order, when Mr MacAndrew said that, although it was customary on occasions like the present for candidates to expound their political sentiments, in his case this might, perhaps, to some extent be dispensed with, seeing that he was now an old stager in Otago politics...",
old stager,"Apr 6, 1866",Daily Southern Cross,,6,,"One of these gentlemen - his hon. friend Mr. Stafford - might be considered what was called an ""old stager"" in the political world of New Zealand, having had the honour of being the head of the oldest-lived Ministry, not only in New Zealand but in any of the neighbouring colonies.",
old stager,"Apr 3, 1856",Daily Southern Cross,,3,,"On Saturday, an old stager, named William Greenwood, was charged at the police office with having no visible means of support, and with being an idle and disorderly character.",
old stager,"Dec 15, 1841",New Zealand Gazette & Wellington Spectator,,3,,"On a beginner, one or two pipes will have an effect; but an old stager will continue smoaking [sic] for hours.",
old stager,"Apr 15, 1854",New Zealand Spectator & Cook's Strait Guardian,,3,,"I am too old a stager in the ""press-gang"" to have any sympathy with those who object to anonymous printing, or to care on my account about anonymous attacks and misrepresentations.",
old stager,"Mar 4, 1865",Daily Southern Cross,,4,,.. but there is no cure for the vices of an old stager.,
old woman from Botany Bay,1953,Unorganized Games,SUTTON-SMITH,2/432,,"The Dialogue game of Caricature includes The Old Lady from Botany bay. In this game the children must not laugh at the old lady although she does her best to provoke them to do so. It has been known as Diggley Bones (Auckland [19]00), An Old Man from B.B. (Palmerston [19]10), An Old Lady from Poverty bay (Wellington [19]00). It is widely reported in the last twenty years. The Old Lady comes up to the children and says `Here comes the Old Lady from Botany Bay, and what [433]have you got to give her today. You must neither laugh nor smile but say ----'. Then the child would say something funny but try not to laugh when doing so. ... (Nelson [19]49).",
