Head Word,Date,Source,Author,Vol / Page,Edition,Quote,Notes
other side,"Feb 11, 1843",New Zealand Gazette & Wellington Spectator,,2,,"Such remissness as this is highly blameable, especially when it is an English mail, as persons are always anxiously waiting for news from their friends at the other side of the globe.",
other side,"Nov 5, 1910",Grey River Argus,,6,,THE OTHER SIDE. LONDON .. The Marquis of Northhampton had hundreds of forms under the Budget to comply with. He filled them up without difficulty.,
other side,1874,Crusts: a settler's fare due south,KENNAWAY,8,,[Hdg] Landing on the Other Side.,
other side,1874,Edward Crewe,BAINES,21,,"The natives seemed intuitively to know that I was a new `pakeha' by that ship from `the other side', for, pointing from me to her inquiringly, I nodded.",
other side,1899,"Pirate Chief and the Mummy's Complaint..., The",SKEY,Page 129,,"On 'the other side',* Sam, you'd have swung on a tree, / To warn other liars about; / But, respecting your age, we'll let you go free. / With just a mild taste of the knout. [* New Zealanders signify by this expression, Australia.]",
other side,"May 24, 1894",Otago Witness,,37,,"Fred Jones is a very promising local conjurer, and, if I remember rightly, was a pupil of Tommy Driver, late of this city, now an othersider.",
other side,1881,Waitaruna,BATHGATE,277,,"You think it a queer way of killing a pig with a tomahawk, do you? ... But once I put a tomahawk to a different use, for I tried it on a man on the other side.",
other side,1884,Recollections (various authors/titles),COX,125,,"Christchurch Magistrates' [Court] I ax your pardon, zur, but were you ever at the Yan Yean works over the other side.",
other side,1899,"Pirate Chief and the Mummy's Complaint..., The",SKEY,129,,"On 'the other side',* Sam, you'd have swung on a tree, / To warn other liars about; / But, respecting your age, we'll let you go free. / With just a mild taste of the knout. [* New Zealanders signify by this expression, Australia.]",
other side,1891,Casual Ramblings,A TRAMP,36,,Mrs White .... tells me [patent saddles] are quite common on `the other side',
other side,1891,Frank Melton's Luck,COTTLE,124,,An old friend of mine came across from the other side (meaning Australia),
other side,"Oct 15, 1896",Otago Witness,,,,And every boat that crosses from sunny `other side' / Is bringing waves of shearers...,in 1967 Bailey and Roth Shanties 131
other side,1890,Station Ballads,McKEE WRIGHT,38,,"There was chaps from the other side that I shore with that I'd like to have taken along for mates,/ <i>Ibid.</i> 53 Every boat that crosses from the sunny `other side' / Is bringing waves of shearers.",
other side,1898,"Grain of Gold, The",'H',50,,The last news of Ben was also from `the other side'.,
other side,"Apr 7, 1906",NZ Truth,,42/5/8,,He made the mistake [of] ... describing himself as an Australian ! Some ... have peculiar ideas about our neighbours `on the other side'.,
other side,1912,Five Years in NZ,BOOTH,39,,"[In the accommodation house were] the villainous-looking 'lag' from 't'otherside', the bullock puncher, whose every alternate word was a profane oath, the stockrider, in his guernsey shirt and knee boots ...",
other side,1933,"Press, The",15,,,Other Side. - Australia. I suppose it is a contraction of `the o.s. of the water'. The expression is still in common use. The word o.sider has never been in use here.,Acland Glossary
other side,1941,NZ Slang,BAKER,43,,"The other side has for long been current in this country for the Commonwealth, i.e. the other side of the Tasman.",
other side,1949,High Country Days,NEWTON,196,1950,OVER THE OTHER SIDE: A shearer's name for Australia.,
other side,1949,Dictionary of Slang Addenda,PARTRIDGE,1127,,"Other side, the. 2. Australia: New Zealanders': since ca. 1880. B., 1941, `The other side of the Tasman [Sea]'.",
other side,1951,High Country,McLEOD,16,,...lean Australian blademen from `the other side' across the Tasman [and] tough old Merino shearers....,
other side,1966,"English Language in Aust. & NZ, The",TURNER,147,,A professional New Zealand shearer is likely to spend some time working `over the other side' as shearers call Australia.,
other side,1968,NZ Contemp. Dict. Suppl. (Collins),,14,,"other side, (the) n. Australia (i.e. other side of Tasman Sea).",
other side,1988,"Dictionary of Kiwi Slang, A",McGILL,80,,"Other Side, The Australia, the other side of the water; c.1880.",
other side,1906,Some Ups and Downs in NZ&A,PICARD,7,,I've crossed you away ... that big drought sun-blazed continent the other side of the ditch.,
other side,"Apr 6, 1893",Otago Witness,,49,,ON THE OTHER SIDE. .. The first impression that a New Zealander gets in travelling through Australia is that of difference.,
othersider,1933,"Press, The",,,,The word other sider has never been in use here.,Acland
othersider,"Mar 5, 1910",NZ Truth,,3,,"While admitting that the othersiders can do just as they please with N.Z. bowling, the palpable leg-pulling that has gone on so far is irritating.",
Otira joys,1934,"Marigold Book of Recipes, The",,24,,OTIRA JOYS ... rolled oats ... flour ... B.P. ... butter ... sugar ... 1 egg ... vanilla ... salt ... Bake pale brown. To be eaten buttered.,
Otiran,May 1978,Geological Society of NZ Newsletter,,45/17,,"M.Mabin - ""A Reinterpretation of a late Otiran radiocarbondate from the Middle Mariwa Valley, S.E. Nelson.""",
OTS,"May 18, 2002",Listener (New Zealand Listener),,6,,"Instead of focusing only upon the workings of the Crown Forestry Rental Trust (mistakenly seen as a Maori agency), it would also investigate those of the Office of Treaty Settlements (OTS), the Crown agency charged with managing the settlements process. The absence of OTS from the <i>Assignment</i> programme was glaringly obvious.",
otter,1974,Proceedings NZ Ecol. Soc.,,21 : 60,,"Haast's firm description of the tracks seen by him as ""exactly resembling those of the otter of Europe, only a little smaller"" strongly indicates some species of the genus <i>Lutra</i>.",
otter,"May 6, 1903",Hawera & Normanby Star,,4,,IS THE NEW ZEALAND OTTER A MYTH?,
otter,"Jun 4, 1926",Evening Post,,6,,He could not believe in the New Zealand otter.,
otter,"Aug 28, 1926","Press, The",,13,,"The rumour of the ""beaver or otter"" is mentioned by Butler in his ""First Year in the Canterbury Settlement"".",
Oturi Interglacial,May 1976,Geological Society of NZ Newsletter,,41/23,,"Ages both younger and older than the limit of 14C dating have been obtained from each terrace, although the lowest (and youngest) terrace is correlated with the Oturi Interglacial, and therefore thought to be beyond the range of dating.",
oui,1982,Where it all Began,MALCOLM,109,,"Clothes for bushmen were included, as well as.. kegs of mutton bird (oui) for the Maoris.",
our boys' pudding,1915,Our Boys Cookery Book,,83,,OUR BOYS' PUDDING flour ... dripping ... sugar ... ginger ... golden syrup ... carbonate of soda ... Boil ...,
our inner Kim Hill,"Jan 15, 2003",Dominion Post,,B7,,"The promo alone made the hair on my legs bristle... A comedy? ""I don't think so,"" our inner Kim Hill will have scowled.",
Our Lady of October,"Feb 3, 1985",NZ Times,,12,,"Up to 10 years after such a bushfire, ... some stumps were soothed with a brief cool bandage of white native clematis, which is called, charmingly, Our Lady of October over The Hill in Takaka.",(Jim Henderson)
our muttons,1941,NZ Slang,BAKER,vi 54,,"The farming community has given us [this century] another useful expression in our muttons. When we speak of something being our muttons or a person's muttons, we mean that it is regarded with particular favour, that we like it especially well.",
Our Place,"Aug 8, 1998",Dominion,,52,,"Our Place? Get off the grass... For the Soundings Theatre in Te Papa, he was quoted $3000 a night.",
Our Place,Apr 2000,North & South,,48,,Feel out of place in Our Place? Feel patronised by the hey! wow! gosh! tone of its signage and its deconstructivist approach to knowledge?,
Our Place,"Mar 6, 1999",Listener (New Zealand Listener),,41,,[Caption] We have <i>no</i> problem with Te Papa hosting a Star Trek (R) exhibition... This is <i>our</i> Place & we've got the remote.,
ourisia,"Dec 27, 1867",Otago Witness,,9,,"These included specimens of the Ranunculus, believed to be Ranunculas Traversii, and of Celmisia Verbascifolia, Senesio Bifestulosus, Ourisia Sessilifolia, Ourisia Macrocarpa, and one or two other plants which it was impossible to recognise by Hooker's Handbook, or even with Mr Beverly's assistance.",
ourisia,1908,AJHR,COCKAYNE,,,<i>Ourisia Colensoi </i>,Botanical Survey Tongariro National Park
ourisia,1908,AJHR,COCKAYNE,,,<i>Ourisia caespitosa </i>,Botanical Survey Tongariro National Park
ourisia,1982,Stewart Island Plants,WILSON,252,,<i>Ourisia caespitosa Creeping ourisia </i>... Creeping forming deep green patches ... Flowers white ...,
ourisia,1906,Plants of NZ,LAING & BLACKWELL,,,,
ourisia,"Dec 27, 1867",Otago Witness,,9,,"These included specimens of the Ranunculus, believed to be Ranunculas Traversii, and of Celmisia Verbascifolia, Senesio Bifestulosus, Ourisia Sessilifolia, Ourisia Macrocarpa, and one or two other plants which it was impossible to recognise by Hooker's Handbook, or even with Mr Beverly's assistance.",
ourisia,1909,AJHR,C-12,COCKAYNE,,,Botanical Survey Stewart Island
ourisia,"Mar 16, 1870",Taranaki Herald,,2,,"In the same neighbourhood are to be found the beautiful Ourisia Macrophyla which resembles the Chinese primrose, - besides many of the most lovely and rare ferns that are to be found in New Zealand.",
ourisia,1906,Plants of NZ,LAING & NLACKWELL,,,,
ourisia,1908,AJHR,COCKAYNE,,,,Botanical Survey Tongariro National Park
ourisia,1909,AJHR,COCKAYNE,,,,Report on a Botanical Survey of Stewart Island
ourisia,1909,AJHR,COCKAYNE,,,,Report on a Botanical Survey of Stewart Island
ourisia,1906,Plants of NZ,LAING & BLACKWELL,,,,
ourisia,"Oct 17, 1900",Otago Witness,,68,,"In among bits of rocks kept swampy with water are growing .. the pure white ourisia, delicately lovely in shape and colour, two or three blossoms on a slender stem rising from a bed of dark green leaves.",
ourisia,1900,Canterbury Old & New,,188,,"The great white buttercup of the Southern Alps, handsomest of its genus, grows in profusion, only rivalled in beauty by the marguerite-like flowers of the numerous different kinds of `cotton plant' or mountain daisy [fn Species of <i>Celmisia</i>.]. To this assemblage of plants also belong the New Zealand `Edelweiss' [fn <i>Helichrysum grandiceps </i>] (no mean representative of the Swiss plant [190] from which it derives its name), and the exquisite white-flowered ourisias [fn <i>Ourisia macrocarpa</i> and <i>macrophylla</i>.], ...",
ourisia,1981,Paparoas Guide,DENNIS,165,,"In the spring a number of ourisias flower on the Paparoa tops, including the mountain foxgloves <i>O. macrocarpa</i> and <i>O. macrophylla</i> (the latter of which also grows in the lowlands).",
ourisia,"May 7, 1896",Otago Witness,,18,,"New Zealand Alpine Flowering Plants, packed and delivered free on rail .. Ourisia (3 varieties) ...",
ourisia,"Feb 20, 1886",Otago Witness,,8,,"Your specimens arrived in fine order, are very highly prized, and for which accept best thanks. No.1 is ligusticum aromaticum; 2, ourisia glandulosa ...",
ourisia,1933,"Canterbury Mountaineer, The",,II/40,,There were keas everywhere.. with threevery wicked ones having a contest to seewhich could bite off the most ourisiastems.,
out and outer,1903,NZ Illustrated Magazine,,7/419,,"We assured him that they could [walk], that in short we considered them out and outers at it.",
out country,"Aug 21, 1912",Evening Post,,5,,"The claim of the backblocks settlers were [sic] paramount, and it was the duty of the Government to construct roads in the out country.",
out,"May 6, 1917",NZEF Chronicles,,137,,`Out' bettors tore their hair and swore -/ The `ins' were in the sun!,
out,1860,Richmond-Atkinson Papers,,2/140,,"Red tape, we `outs' call it.",
out,1944,Troop Target,FULLARTON,24,,... a milk-run out Henderson way.,
out,1985,G'day Country,McGILL,171,,"Alan didn't have a bad life in Dunedin, probably because a good deal of it was out the point, at Puratanu. `I've got a wee crib there. Get over as often as I can. ... I've always liked the old shellfish, the gulls and herons.",
out,"Dec 18, 1909",NZ Truth,,234/6/3,,"They entered the bonds a few years back, and have a child now two and a-half years of age, which is `out,' or, in other words, is being reared in some institution",
out,1999,Eugene Nelson Glossary,NELSON,3,,The cows are not out for the worst of the winter.,
out for a rest,1918,New Zealand At the Front,,32,,"Out for a Rest. - Vide Fatigues. Fatigues. - Popular pastimes for portly privates, corpulent corporals, and sedentary sergeants.",(Digger's Dictionary)
"Out House, The","Nov 16, 2005",Express (Gay & Lesbian Express),,6,,"The last fortnight saw The <i>Out House</i> say good bye and <i>Kiwi Fruit</i> step into its 11pm, Monday night shoes. ... Also by the time the <i>Out House</i> started to get good it was over. ... [7] <i>Kiwi Fruit</i> is his first on-screen role. ... The gayest thing about <i>Kiwi Fruit</i> is probably the presenters.",
out of collar,1897,Station Ballads,WRIGHT,30,,"For coves thats out of collar, mate, there's hunger in the air.",`Swagger'
out of collar,1881,Chequered Career,NESFIELD,51,,"If a man is willing to work, ... he need never be long `out of collar'.",
out of one's chooks,1981,Foreskin's Lament,McGEE,22,,"There we were, caught red-handed, high as kites, right out of our chooks, going down a one-way street the wrong way.",
out of one's tree,"Aug 20, 2003",Capital Times,,3,,"""...how many can be sure of the difference between having a wild time while 'being out of your tree' and, on the other hand, being blind drunk, dazed and 'out of it'.""",
out of one's tree,"Nov 22, 1986",Listener (New Zealand Listener),,46,,MC: I'm drunk. ...Drunk. Tanked. Cut. Sloshed. Out of my tree. Shickered to beat the band.,
out of the bush,1994,From Drover to Director,PLUMMER,27,,"Ohinepotea was about two thousand acres, fairly steep country, much rougher than Otaranui with plenty of logs around as it hadn't been out of the bush all that many years.",
out of the bush,1956,Farms & Stations of NZ Vol I,TAIT,88,,"Ditton, situated 12 miles from Masterton, was taken up out of the bush by Mr S Mawley.",
out of the cactus,1945,Sixes & Sevens,,18,,(Just read this and climb out of the cactus.),
out of the cactus,Sep 1958,Tararua,,4/4,,"(? here rough bush-bashing, undergrowth track; rough country) Here we camped. The lass with the sprained ankle had done a marvellous job. We were all tired, and relieved to be out of the cactus; nevertheless, our only regret about our route was that the weather had prevented some very interesting photography.",
out of the wool,1973,Big Country of the South Island,NEWTON,38,,"The lambs which are sold out of the wool, in August, go direct to Nelson butchers.",
out of the wool,"Nov 8, 1951",NZ Farmer,,42,,Ewes out of the wool slipped back from the previous year's high values.,
out of the wool,1972,In the Wake of the Axe,NEWTON,166,,These [wether lambs] are sold out of the wool the following spring.,
out of the wool,May 2002,Growing Today,,58,,Another argument in favour of at least twice yearly shearing is young sheep do much better 'out of the wool.',
out on its own like a country shithouse,1988,"Dictionary of Kiwi Slang, A",McGILL,80,,"out on its own, like a country shithouse excellent or unique; eg `Television has introduced somestartling logos over the years, but this one is out on its own, like a country shithouse.' c. 1910.",
out on one's own,1935,Slang Today,PARTRIDGE,287,,"Now don't say that about my tin plate or I'll go crook: He is out on his own and, in fact, he is shook on me. <i>Ibid.</i> 288 You'll do me, D! You are out on your own.",1935 A.E. Strong WW1 scene in Partridge Slang Today
out the back,"Nov 17, 2001",Manawatu Evening Standard,,14,,".. the rolling contour adds interest while out the back, flat paddocks make tending livestock an easy proposition.",
out the back,1960,Back-Country Tales,MASTERS,77,,"One of the musterers, who had arrived in from out the back that day ...",
out the back,1970,Under the Nor'West Arch,PORTER,47,,It was then I headed 'out the back' and became a hunter for deer hides.,
out the monk,1946,Johnny Enzed in Italy,,,,"<i>Thirteen List:</i> Army medical list showing personnel stricken by palsy, out the monk, or otherwise sick and ailing.",
out the monk,1947,For the Rest of Our Lives,DAVIN,331,,Let Jerry plug away till he's sick of it and out the monk for petrol,
out the monk,"Aug 21, 1944",NZEF Times,,IV/165 : 5,,"Our water-bottles had it (what's known as ""out the monk"").",
out the monk,"Aug 28, 1944",NZEF Times,,IV/166 : 4,,I'm dashed near out the monk.,
out the monk,"Sep 4, 1944",NZEF Times,,IV/167 : 4,,"Then how about the Bulgarians?... They tell me they are out the monk, too.",
out the monk,"Oct 23, 1944",NZEF Times,,IV/174 : 5,,"Everything's not roses When trucks are ""out the monk.""",
out the monk,"Dec 18, 1944",NZEF Times,,IV/182 : 4,,I see you missed it this week and you're out the monk.,
out the monk,"Feb 5, 1945",NZEF Times,,IV/189 : 4,,When jokers go out the monk on vodka.. hey have to build an inacke round them before they wake up.,
out the monk,"Oct 30, 1944",NZEF Times,,5,,Without a [flit-gun] you're out the monk.,
out the monk,1946,Johnny Enzed in Italy,,41,,"`I got the NZEF Times today,he said' said the bloke, `and I see you two spruikers have had it ... I see you missed it this week and you're out the monk, says this rooter `said the bloke.' I've been waiting for them to give you the bum's rush ... he says'",
out the monk,1965,Stand in the Rain,WATSON,135,,Tony saw Dick and Fred out the monk under them pine trees by the lake yesterday.,
out the monk,"Feb 5, 1945",NZEF Times,,45/4,,When jokers go out the monk on vodka they have to build an inacke around them before they wake up.,
out the monk,1945,Sixes & Sevens,,7,,"Take Joe's [sc Stalin's] boys, for instance. ... All out the monk on vodka sta sera, I'll bet.",
out the monk,1959,"Gun in My Hand, A",SLATTER,135,,And those drunken sprees helped the others to forget. But no-one ever saw him out the monk. No-one ever saw Mick paralytic.,
out the monk,1970,On the Ball,SLATTER,136,,Play is stopped when one of the forwards is seen to be out the monk but they soon bring him round and down goes the scrum again.,
out the monk,"May 21, 1945",NZEF Times,,IV/204 : 5,,"We trust you will promptly deny anyallegations that our disappearance fromyour esteemed journal is due to the factthat we are (a) out the monk (b) absentwithout leave (c) in the boob, and (d) onthe snorer.",
out the monk,"Dec 24, 1945",NZEF Times,,IV/235 : 8,,"Every time it was necessary to put him[sc. a pig] in the box for a move he wasput ""out the monk"" by a hyperdermic [sic]injection of morphia.",
out the monk,1976,Pallet on the Floor,MORRIESON,69,,"It's Jack Voot, real shickered. Looks like he's out the monk.",
out the monk with,1946,Johnny Enzed in Italy,,54,,I'm out the monk with the O.C.,
out to it,1988,"Dictionary of Kiwi Slang, A",McGILL,80,,"out to it unconscious, often from too much alcohol; eg `Clive wanted to continue with the pub crawl, but Keith was out to it.' NZA.",
out-blocker,"May 10, 1913","Triad, The",,35,,"It has been my calling these many years to travel up and down this land, in the course of which I have met college professors, college graduates, dungareed out-blockers, and the varied gamut between,",
out-building,Feb 1894,NZ Farmer,,37,,There is .. repairing and painting all implements and out-buildings.,
out-class,"May 12, 2010",Horowhenua Chronicle,,3,,"""Out-classes are focussed on individuals, tutors have been able to reach out to Maori, and to encourage and facilitate success,"" she said.",
out-district,"May 8, 1908",Wanganui Herald,,7,,Perch have been distributed in the out districts.,
out-district,"Dec 14, 1889",Northern Advocate,,2,,"<i>We shall be glad to receive correspondence from out districts, as we wish every locality represented in the </i>ADVOCATE.",
out-district,"Mar 7, 1857",Nelson Examiner and New Zealand Chronicle,,2,,"For we, too, have a most valuable and extensive out-district, similarly occupied or made use of by settlers of equal education and influence.",
out-district,"Aug 27, 1864",Weekly News,,10,,We have not an easy means of communication with our out-districts.,
out-district,"Jun 9, 1858",Richmond-Atkinson Papers,,1/408,1960,... the sale of spirits on the two gallon system. This I consider to be the chief curse of the out districts.,(J. Morgan)
out-district,1858,BLANK ENTRY,,408,,The sale of spirits on the two-gallon system. This I consider to be the curse of the out-districts.,in Scholefield (1960) Richmond-Atkinson Papers I
out-district,"Mar 27, 1894",West Coast Times,,4,,Returns from the out districts of the electorate are not to hand but the pool is certain to be less than half the roll number and will therefore be inoperative.,
out-district,"May 8, 1911",Grey River Argus,,5,,It is situated on St. John's Hill and commands a view of the whole of the town and out districts.,
out-district,"Apr 17, 1873",Daily Southern Cross,,2,,Our out-district subscribers are requested to communicate with the respective agents of the districts in the event of the delivery of thier papers being attended by any irregularity.,
out-fence,Aug 1984,NZ Journal of Agriculture,,45,,"The 1984 Golden Pliers Farm Fencing champion is Alan Shuler of Rerewhakaaitu, who out-fenced seven other finalists.",
out-flock,1939,First White Boy Born in Otago,BEATTIE,52,,"I consider Jone had 4000 sheep when the 1848 settlers came, as in addition to the three out-flocks of 1000 each he had fully 1000 at the homestead.",
out-hut,1874,Crusts: a settler's fare due south,KENNAWAY,182,,"No hour's shepherding and back, - ... no stroll to the out-hut, - but a positive, unmistakable expedition, with extra-heavy packs",1861 May letter in 1874 Kennaway Crusts
out-hut,1900,Colonial Turf,SCOTT,165,,"Periodical rounds to the out-huts, taking the shepherds their rations.",
out-hut,1933,Autobiography,JONES,60,,"Nowadays, I believe most of the runs have out-huts built to save the trouble of shifting the tents etc.",
out-hut,1881,Waitaruna,BATHGATE,145,,Next day Langton and Leslie set out on an expedition to the out-hut to see how Mike was getting on ...,
out-hut,"Oct 17, 1885",Otago Witness,,1,,"I went in search of fresh meat, which we were informed could be got in the shape of mutton at an out-hut of Mr Rees' station, some three or four miles from camp.",
out-hut,"Jul 28, 1883",Tuapeka Times,,2,,"John McKenzie .. gave evidence of having left a hut near to the home station, about the end of May last, to reside temporarily at another out-hut on the station.",
out-life,1927,Old Savage,DEVANNY,95,,Brett was a man of the out-life of the waters and of the bush.,
out-of-zone,"Mar 24, 1953",Evening Post,,14,,"At last week's meeting of the Wellington Education Board, in reference to the board's refusal to admit two out-of-zone children...",
out-passioned,"Jun 13, 2004",Sunday Star Times,,B2,,The forwards out-jumped and out-passioned the English tall timber...,
out-passioned,"Sep 5, 1999",Sunday Star Times,,B2,,"Randle's simple appraisal his side was ""out-passioned"" was spot on.",
out-passioned,"Oct 17, 1999",Sunday Star Times,,B1,,"Mourie paid tribute to the huge effort put in by his tight five yesterday, who, to use a popular phrase, ""outpassioned"" their Waikato opposites... The tight I've and loosies really stood up and put in a huge effort which did us proud.",
out-passioned,"Nov 2, 1999",Dominion,,22,,"He also rejected any assertions that the All Blacks had been out-passioned, as he had said they were when they lost 28-7 to Australia in Sydney in August.",
out-passioned,"Jul 9, 2000",Sunday Star Times,,B1,,"It was a performance in which the Kiwis admitted they were ""outpassioned"".",
out-passioned,"Nov 12, 2000",Sunday Star Times,,B4,,"In essence, Smith is saying the All Blacks can't afford to be out-passioned, as they have so often been in the past.",
out-physical,"Jul 9, 2004",Dominion Post,,C12,,They didn't take a physical approach to the game and were out-physicalled by the Island side.,
out-settlement,"Jan 3, 1893",Nelson Evening Mail,,2,,Before leaving the district the Inspector visited all the out settlements.,
out-settlement,"Mar 4, 1886",Poverty Bay Herald,,2,,"A settler in one of the out settlements became enamoured of a girl employed in an hotel there, who reciprocated his affection, but her mother refused to consent to their marriage, and the couple decided to elope.",
out-settlement,"Nov 15, 1875",Evening Post,,2,,"The North Island out settlements, we are told, teem with these unregistered M.D.'s, and there is scarcely any possible way of reaching the offenders, private individuals considering it to be no affair of theirs, or at least one in which, for interfering, they would receive but little thanks for their trouble, while there are no properly appointed officers of the Government to look after the matter.",
out-settlement,1863,Richmond-Atkinson Papers,,1/591,,Out-settlements of the Auckland Province.,
out-settlement,1868,Papers,McLEAN,28/227,,[The enemy] will retaliate upon our out-settlements.,(J.D. Ormond) HBay
out-settlement,1910,Reminiscences,McDONALD,19,,"I will now refer to the outsettlements or back-blocks of the early New Zealand days. <i>Ibid.</i> 18. ... when I come to write of the outsettlements from Wellington, or as they are now called, the `back blocks', ...",
out-settlement,1922,"NZ Wars, The",COWAN,2/138,,"... Panapa, Nikora, and Te Rangihau were to deal simultaneously with the out-settlements of pakeha and Maori and then join in the sack of Napier.",
