Head Word,Date,Source,Author,Vol / Page,Edition,Quote,Notes
Armed Constabulary,"Jan 1, 1887",Auckland Weekly News,,7,,"[Inscription] This monument, to the memory of the Officers and Men of the Armed Constabulary And of the Patea Field Force.. Is erected by the Officers and Man of the A.C. Field Force.",
Armed Constabulary,1979,They Called Me Te Maari,HARSANT,56,,"Here we would take potatoes and matches,and then catch a small variety of carpcalled 'morihana'... Their Maori name,'morihana', was a translation of""Morrison.' A captain, I believe, in theArmed Constabulary days, Morrison hadintroduced the fish to Taupo and LakeRotorua",
Armed Constabulary,1936,Pioneering Reminiscences of Old Wairoa,LAMBERT,153,,"... the discovery of Waikare-iti by Major Goring, of the Armed Constabulary Force.",
Armed Constabulary,"Sep 24, 1868",Richmond-Atkinson Papers,,2/278,,Whitmore has gone as a Volunteer to the front. I need hardly say that he is Commandant of the Armed Constabulary.,H.A. Atkinson
Armed Constabulary,"Jun 30, 1869",Richmond-Atkinson Papers,,2/289,,".. they propose ...taking up defensive posts within our own `frontier', reducing the armed constabulary, for they have `no sympathy for a standing army' ...",J.C. Richmond
Armed Constabulary,1984,Red Coat to Jungle Green,BARBER,,,"I would say that the Armed Constabulary is now composed of healthy, sober and intelligent men, who are daily improving in discipline and efficiency.",original citation from 1871 Commandant Moule in AJHR G-5
Armed Constabulary,"Dec 22, 1986",Dominion,,7,,"The lower barrack [at Wellington] is well kept, being occupied by the Armed Constabulary, but the upper barracks are falling rapidly into decay.",Original quote from 1871 William Fielding Diary
Armed Constabulary,1878,Forty Years in NZ,BULLER,11,,"There are ... a chain of [12] military posts [between Tauranga and Napier], all of which are manned by detachments of the `armed mounted constabulary'.",
Armed Constabulary,1922,"NZ Wars, The",COWAN,1/177,,"He became captain in 1863, and served in the Military Settlers, and later in the Armed Constabulary as Sub-Inspector.",
Armed Constabulary,1932,Fifty Years In Maoriland,PINFOLD,23,,... so they [Te Whiti followers] were arrested by the armed constabulary and imprisoned.,
Armed Constabulary,1936,Pioneering Reminiscences of Old Wairoa,LAMBERT,41,,"Major Goring, who was then in charge of the Armed Constabulary at Onepoto, ... determined to ... explore these unknown regions.",
Armed Constabulary,1964,Settlers in Depression,NORRIS,27,,"With the transfer of the Armed Constabulary headquarters from Hamilton, this building, with much else of the A.C. buildings, was removed to Cambridge.",
Armed Constabulary,1966,"Encyclopaedia of New Zealand, An",,3/331,,"SUTHERLAND, Donald (1839-1919). Backwoodsman. ... Like so many more of his kind he became embroiled in the Maori Wars, [332] and when fighting was finished he left the Armed Constabulary and took a job ... on a Government steamer.",
Armed Constabulary,"Oct 26, 1972",Dominion,,13/4,,The redoubt [at Taupo]was constructed by the Armed Constabulary in about 1870.,
Armed Constabulary,1986,"NZ Wars, The",BELICH,214,,"In 1867, this miscellany of units was greatly reduced in numbers and formed into a colonial regular army, euphemistically named `the Armed Constabulary'.",
Armed Constabulary,1986,Na To Hoa Aroha,SORRENSON,1/13,,"Peter's father had gone to Urenui as part of the Armed Constabulary; even though he had taken his discharge, he could still be called into service against the Maoris in the event of an emergency.",
Armed Constabulary,1875,Adventuring in Maoriland in the Seventies,MEREDITH,83,,Things looked a trifle ugly [at Wanganui over Maori land rights] for a short time; the armed constabulary were mustered and dispatched to the vicinity to be in readiness for any emergency .,1935 ed.
Armed Constabulary,1983,Land of the Mist,,,,Te Kooti was pursued by Armed Constabulary and Ngati Porou forces ...until he escaped to the King Country in May 1872.,
Armed Constabulary,"Oct 26, 1972",Dominion,,,,[Caption] A number of former Armed Constabulary huts also adorn the [Taupo] hotel ground.,
Armed Constabulary,Jun 2002,NZ Memories,,57,,[Caption] The Armed Constabulary Redoubt can be seen at left across the river.,
Armed Constabulary,Jun 2002,NZ Memories,,58,,"In October 1867 'The Armed Constabulary Act' was introduced and this enabled Governor Grey to recruit men to serve as an armed constabulary force for the purpose of: ""<i>Putting down rebellion, quelling disturbances, preserving the peace, preventing robberies and other felonies, and apprehending offenders against the peace.</i>""",
Armed Constabulary,"Oct 4, 2003",Listener (New Zealand Listener),,29,,...the expensive Armed Constabulary (AC) field force was redeployed piecemeal to occupy a line of posts and stations from Poverty Bay and Hawke's Bay to Lake Taupo and across to the Bay of Plenty.,
Armed Offenders Squad,"Dec 12, 1992",Dominion,,10,,Most of them fall as short of their target as a barrage of shots from an armed offenders' squad.,
Armed Offenders Squad,1980,"Personal Kiwi-Yankee Dictionary, A",LELAND,9,,A S.W.A.T. TEAM unarmed (as are criminals) this is a very special group of armed police called out to deal with armed criminals who have shown a willingness to use their weapons.,
Armed Offenders Squad,"Oct 10, 1987",Dominion,,3,,"The police armed offenders squad surrounded a Lower Hutt house early this morning after a man had barricaded himself in with a machete knife, numchakas and a rifle.",
Armed Offenders Squad,1989,Frigate Bird,CAMPBELL,77,,"`The Armed Offenders Squad has been called out,' shouts someone.",
Armed Police Force,"Feb 14, 1851",NZ Government Gazette,,,,"HIS EXCELLENCY ... has been pleased to appoint/ MR. ROBERT SMITH,/ Sergeant in the Armed Police Force, to discharge the duties of Inspector of Sheep and Slaughter Houses, ...","NZGG (New Munster) 21 Feb IV/5/25 Colonial Secretary's Office,/ Wellington"
armo,Oct 1999,NZWords,,2(2) : 2,,Words for crimes include <i>armo</i> for an armed robbery.,
armo,"May 29, 1997",Dominion,,3,,"""Seems like every time there's an 'armo' I get busted,"" he said.",
armoured cow,1950,Excuse my Feet!,SARGE,,,Armoured Cow: (Kiwi-ism) `tinned milk',Glossary
Armstrong's patent,May 1952,Evening Post,,,,[Letter to the editor saying that this terms was used in the Hutt Valley 50 years ago] (R. Mason: phs from a brand-name),?d May ?p
aroha,"Feb 18, 1995",Listener (New Zealand Listener),,56,,"If they had not been warmed by the aroha, the multitude outside would have got pneumonia.",
aroha,Dec 1996,Mana,,No. 11 : 82,,"We're not asking for aroha. We're saying: ""Here's the deal.""",
aroha,"Jun 14, 2001",Dominion,,25,,The two companies combined in a creative curtain call to send out a message of aroha.,
aroha,"Dec 6, 2005",NZ Herald,,C8,,"His Worship the Mayor Sir Barry Curtis, Deputy Mayor Anne Candy, Manukau City Coucillors, City Manager Colin Dale, Director of City Services Wayne Goodley and council staff, extend all their aroha and awhinatia to John's whanau, especially his hoa wahine Raiha, tamariki and mokopuna.",
aroha,1804,English Colony in NSW,,559,,"E-huf-fe[acute], Love.",NZ Vocabulary
aroha,1817,New Zealand (various authors/titles),NICHOLAS,2/329,,"Affection, love Aro[acute]ha",English-NZ Vocabulary
aroha,1820,Grammar & Vocabulary of the Language of NZ,LEE & KENDALL,136,,"Ar|oha, s. ... Love.",
aroha,1835,Journal,BOULTBEE,109,,fond - eroa' [aroha],
aroha,"Dec 14, 1832","Early Journals of Henry Williams, The",WILLIAMS,267,,"Saw Aroha the young woman who has been ill for a considerable time, ... but we could not communicate with her; ...",
aroha,"Mar 28, 1863",Robert Maunsell,WILY & MAUNSELL,150,,"`Now, dearest George, adieu. All send much aroha. [fn] Love.",Mrs Maunsell letter in Robert Maunsell (1938)
aroha,1905,Where the White Man Treads,BAUCKE,90,,"Sing songs of sentiment, with deft allusion to that tender yearning of the heart, that mystery, which answers to the call of `Aroha' (love).",
aroha,1963,Pohutukawa Tree,MASON,48,,AROHA: Queenie: the young people are just off. Go and give your aroha to Miss Sylvia.,
aroha,1968,NZ Contemp. Dict. Suppl. (Collins),,2,,aroha ... n. love [Maori].,
aroha,1969,Collected Poems,BAXTER,442,,"And the rainbow of aroha shine on each one's face/ Because love is in the look, ...",1969 in 1979 Baxter Collected Poems
aroha,1976,Love and Legend,SHADBOLT,174,,His [Baxter's] journey into aroha took him first among the lame dogs and junkies sheltering in the decadent housing of central Auckland city ...,
aroha,Feb 1981,Avondale College Slang Words in Use,,,,aroha,(Auckland) (Goldie Brown Collection)
aroha,1982,Selected Poems,BAXTER,188,,aroha love,Glossary
aroha,1982,Collins Concise English Dictionary,,56,,"aroha n. N.Z. love, compassion, or affectionate regard. [Maori]",1986 NZPOD 35; 1985 Collins NZ Compact Dict. 26
aroha,1983,"Bone People, The",HULME,467,,178 Aroha = love,Translation of Maori Words
aroha,1985,Towards Taha Maori,HOWE,19,,"Aroha - `love' is an inadequate translation. Aroha refers to love for one's own family group, but the tendency now is to use it to refer to one's love for all people, i.e, goodwill. It combines the positive qualities of respect, kindness, hospitality, help and the desire to do good for other, without thought or desire for reciprocal action. It is charity of feelings. (I have yet to hear it used in a sexual sense). Aroha comes from knowing that one's kin shares common ancestors",Towards `Taha Maori' in English (NZATE)
aroha,"Dec 6, 1986",Listener (New Zealand Listener),,17,,"Crime, violence and aroha in Shannon.",
aroha,1986,Te Kaihau,HULME,94,,"Five weeks, I'd thought then, just five weeks and already the aroha grows.",
aroha,1987,Metro,,6,,Polynesian peals of laughter ... and aroha permeating everything.,"Keogh, ChiaroscuroMetro Fiction 6"
aroha,1988,Lexicographical & Linguistic Studies,BURCHFIELD,191,,"aroha /|aroha/. N.Z. [Maori, cogn. w. Hawaiian aloha.] Affection, love; sympathy. In Hawaii the phoneme /l/ was sometimes perceived in the late 18c. and the early 19c. as /r/. Hawaiian examples of aloha are not given below.",
aroha,1988,Lexicographical & Linguistic Studies,BURCHFIELD,191,,"aroha /|aroha/. N.Z. [Maori, cogn. w. Hawaiian aloha.] Affection, love; sympathy. In Hawaii the phoneme /l/ was sometimes perceived in the late 18c. and the early 19c. as /r/. Hawaiian examples of aloha are not given below.",
aroha,1826,Narrative of Tour through Hawaii,ELLIS,xii. 357,,The usual salutation is Aroha (attachment).,
aroha,1971,Auckland Journals,DRUMMOND,265,,"Mary Anne Parker .. emerges from this journal - and from her own unselfconscious account of life in early Auckland - as a remarkable woman in many ways, with an aroha for the Maori people that is remembered still.",Vicesimus Lush
aroha,1974,Whanau,IHIMAERA,II.8,,"They will look at you with love, and aroha, for you have honoured them. <i> Ibid.</i> iv. 16 There still remain a number who cherish the ideals of family living and family aroha.",
aroha,"Jan 8, 1977",Whanau,,4-12/8,,"Roy and children and Gardiner family gratefully thank all relatives, neighbours and friends for your personal attendance, floral tributes, cards, telegrams and donations of aroha in our recent sad loss of much-loved wife, mother, daughter and sister.",
aroha,Aug 1978,Islands,,13,,"Please offer my warmest aroha to Miss Gilhooly, and thank her for looking after you sowell.",
aroha,1798,Voyage of Discovery to North Pacific Ocean,VANCOUVER,II. III. v. 139,,"The man instantly replied `arrowhah', meaning that he pitied him.",
aroha,1985,Being Pakeha,KING,iv. 82,,He was a beautifully-natured old man who believed that aroha and manuhiritanga were the primary Maori virtues.,
aroha,1989,Frigate Bird,CAMPBELL,88,,"`Yes, uncle. ... She sent her aroha.'",
aroha,1905,Where the White Man Treads,BAUCKE,23,,"Neither can you define mercy, pity, affection else than by the verb `aroha' (love).",
aroha job,1985,Hey Hey Hey,MITCALFE,84,,"`All right. Give you half and hour [to produce the stolen article]. The police. No mucking around! That set's too expensive to be just another ""aroha job"", ""fa'a Samoa"", all that stuff.'",
arohamai,"Dec 19, 2005",NZ Herald,,C7,,"Passed away 15 December 2005 .. Aroha-mai with love from mum, dad and [sic] brotha xxxxxxxxxxxx",
arohamai,"Nov 16, 2005",Whakatane Beacon,,2,,Arohamai you can carry on now.,
arohanui,"Feb 10, 2006",Whakatane Beacon,,45,,[public notice] .. <b>Arohanui Iris Herewini & whanau</b> <i>God Bless you all</i>,
arohanui,1983,"Bone People, The",HULME,467,,[p] 209 Arohanui = much love,Gloss
arohatinonui,"Apr 18, 2006",Whakatane Beacon,,10,,Happy birthday for today. Arohatinonui.,
arohatinonui,"Dec 30, 2005",Whakatane Beacon,,38,,"God bless you Koro for you were one of the best. Arohatinonui, Ella, Ihaia, Warren and Maui.",
arokura,1929,TrNZI,,61/146,,"This handsome species, the Opah or Moon Fish, is known to the Maoris as Aro kura.",Young
around the traps,"Jun 27, 2003",Dominion Post,,B5,,"Around the traps, however, many say if there is a real factionalism problem, it is right at the top.",
Arowhana-Teratan,Nov 1996,Geological Society of NZ Newsletter,,111/36,,The Mangakuri location has Waiauan age sediment unconformably overlying Arowhana-Teratan age rocks.,
arrear fiend,1926,Transport Workers' Song Book,HENRY KIRK,28,,"Get rid of the Union `cuckoo',/ And the `stool pigeon' as well./ The `arrear fiends' and the `ring-necks' ...",
arrowroot fern,1911,TrNZI,,22,,The native arrowroot fern (<i>Marattia fraxinea</i>) is fast being killed out by pigs on account of its starchy rhizome.,
arse,"Nov 30, 1981",Letters,JONES,187,1982,"I know you will think I am an arse rubbing the salt in like this, ... 1. it's neither my arse nor john jackson's, it's neither one thing nor the other.",1981 Nov 30 in 1982 Jones Letters
arse,1988,"Dictionary of Kiwi Slang, A",McGILL,75,,"nest of sparrows flew out of me arse, a I am sexually satisfied, `Immortal', Jim Henderson rates this c/p.",
arse over kite,"Jun 29, 1998",Dominion,,13,,"Skunk knocks you arse over kite, but hasn't got a long-lasting stone.",
arse over kite,1983,Down from Marble Mountain,HENDERSON,141,,And Ted obeying. And instantly going arse over kite into the six-foot ditch bordering the road.,
arse over kite,1983,Down from Marble Mountain,HENDERSON,242,,"I am dancing cheek to cheek with theloveliest of all.. there in the dark softand almost swooning, miraculously withoutgoing arse over kite blundering against achair",
arse over kite,1965,Special Flower,,144,,` ... And tell her not to come near me again. I'll kick her arse over kite if she does.',
arse over kite,1979,Skin Deep,WILLIAMS,65,,"But try as he might to pick his way through the swirling ranks of choppers to get to them, he's downed, arse over kite, ...",
arse-faced,1998,Night Swimming,NEALE,8,,"I was always waiting for her to bring it up first, for her to crack some smarmy comment about Marion being smashed, half-cut, pissed-as-a-fart, arse-faced as usual.",
Arse-ups,1937,Dictionary of Slang,PARTRIDGE,,18,"Arse-ups, the. The 4th Battalion of the N.Z. Rifle Brigade: New Zealand military in GW Ex the shape of the battalion shoulder-patch.",
Arse-ups,"Feb 12, 1953",2ZB,,,,"In the Great War there were the Square Dinks, the Triangle Dinks, and I won't tell you what we called the other ones but their triangle was upside down - you know what soldiers mean.",Wellington (Lux Money-go-round programme)
Arse-ups,1988,"Dictionary of Kiwi Slang, A",McGILL,10,,"Arse-Ups, The Fourth Battalion, NZ Rifle Brigade, WWI; from shoulder flash.",
arsehole,2005,Watch of Gryphons,Owen Marshall,71,,"Michael thought the ABs were coming right, but Rik and Budgie reckoned they'd get arseholed again by the Aussies.",
arsehole of the world,1971,Bullshit and Jellybeans,SHADBOLT,47,,"There was also quite a bit of grass floating around the camp ... It was strange wandering through the snow utterly stoned, in the middle of the Southern Alps down in the arsehole of the world.",
arsepaper,1989,"Dinkum Kiwi Dictionary, The",McGILL,10,,arsepaper thoroughly despicable or useless person or thing; eg `That new halfback is arsepaper!' ANZ.,
arsewipe,"Aug 14, 2001",Independent Herald (Wellington),,1,,"If you want to take me on, you better look out, you f*****g arsewipe... you f*****g dickhead, look out.",
arsewipe,"Sep 22, 1986",Salient,,15,,"So, Mr capital v., your petty drunken efforts are proverbially childish play. We true alcoholics spurn your complacent abjection. [letter signed] hyper-pseudo-arsewipe the second. [formerly a raped junior sheep] Asylum for the Criminally Depraved",
ARST,"Sep 14, 1996",Listener (New Zealand Listener),,13,,"The Auckland Regional Services Trust (ARST) has certainly not adopted the America's Cup event as its own... Ports of Auckland Ltd, a company 80 percent owned by the ARST, will not be involved in investing any money in the proposed development.",
arsy-boo,1988,"Dinkum Kiwi Dictionary, The",McGILL,10,,"arsey boo chaos, twisted, wrong; eg `I'm going to have to say that the organisation of this reunion is all arsey boo.' [Jim Henderson]",
arsy-tarsy,1988,"Dinkum Kiwi Dictionary, The",McGILL,11,,arsy-tarsy all tangled up and topsy turvy; variant of `arsy-versy'; eg `This essay is all arsy-tarsy. You're going to have to rip it up and start again.' [Shepard],
Art Union,"Aug 2, 1866",Lyttelton Times,,2/4,,,fide A.S. Helm: to be checked
Art Union,1886,Napier Daily Telegraph,,,,"`By permission of the Colonial Secretary Miss Bacon [of the School of Art Needlework, Auckland] will hold a GRAND ART UNION OF WORKS OF ART, comprising handpainted brackets, diapers, cushions, wax work, art needlework. Tickets 2s 6d.'",quoted in 1974 Wood Victorian New Zealanders 18
Art Union,"Dec 26, 1931",Dominion,,13/7,,,[OED2]
Art Union,1937,Brown Man's Burden,FINLAYSON,29,1973,The poor little settlement ... hadn't seen ... such lavishness since Timi Kaituna won the Art Union.,`Wi Gets the Gospel'
Art Union,1945,Gunner Inglorious,,108,,"Instruments scrounged, donated, bought through profits of [prisoner-of-war] camp raffles and art unions.",
Art Union,"Nov 26, 1947",Letters,FAIRBURN,176,1981,"I'm told it,s mainly art union money, ...",
Art Union,"Oct 28, 1947",Evening Post,,8/1,,"USE OF TERM `ART UNION' The use of the term art union was under discussion at a meeting of the Auckland Society of the Arts ... Some time ago a letter was sent to the Minister of Internal Affairs asking if the term could be restricted in its use to that originally intended, namely the disposal of works of fine art. In his reply the Minister said: `The term is well established and its meaning well known in the community, and therefore it is not thought necessary to make specific change at this juncture.' Commenting on the present use of the term, the president ... said that it was obviously incorrect and that the present `art unions' were really lotteries.",
Art Union,"Dec 1, 1961",Evening Post,,17,,"How did the art union, now replaced by the Government's `Golden Kiwi' lottery, come by its name? Officers of the Internal Affairs Department said today they believed that under the law operating when the art unions began in 1929, raffles or lotteries could only have works of art for prizes. Alluvial gold had apparently qualified as a work of art and for some years the prizes were [pounds]4000 in alluvial gold, which had to be deposited in the Bank of New Zealand and paid for before any tickets could be sold. Cash finally replaced the alluvial gold prizes, but the name `art union' stuck.",
Art Union,1959,Verdict on NZ,STONE,14,,The same kind of double morality can be observed in the conflicting attitudes towards lotteries. ... They have ... set their seal of approval on what is euphemistically known as an `art union'.,
Art Union,1963,As Short a Spring,CASEY,279,,I won fifty pounds in an art union once ...,
Art Union,1964,Collected Stories,SARGESON,297,,Art Union: lottery.,Pearson Glossary
Art Union,1966,"Encyclopaedia of New Zealand, An",McLINTOCK,3/347,,"The term `art union' is today used in a wider sense than the sense in which it is employed in the gaming legislation. The art union proper as defined in the Gaming Act exists only to a limited extent in New Zealand, and is confined to a few academies or societies of fine arts. What has generally become known as the art union is the national lottery. The term `art union' is due to the fact that originally the prizes in the lottery were alluvial gold. These major art unions are now known as the Golden Kiwi lottery. .. In 1961 the Government decided to replace the art unions with the present Golden Kiwi lottery.",
Art Union,1966,"English Language in Aust. & NZ, The",TURNER,175,,The term art union is shared with Australia; few remember the times when the prize was a painting.,
Art Union,1973,Brown Man's Burden,FINLAYSON,140,,art union: lottery,Pearson's Glossary
Art Union,"Jun 6, 1981",Listener (New Zealand Listener),,112,,,[I.A. Gordon has a long article on derivation and history.]
Art Union,1982,Collins Concise English Dictionary,,58,,art union n. Austral. & N.Z. a lottery for prizes usually of goods (in Australia) or cash (in New Zealand).,1986 NZPOD 37; 1985 Collins NZ Compact Dict. 26
Art Union,1988,University Entrance Board Bursaries Exam,,English 3,,"Art Union (forerunner of Golden Kiwi Lottery) <i>Ibid.</i> 6 Once when she couldn't have me Dad let me go to the flicks by myself. He gave me some extra money, so I went to the milkbar and bought a gobstopper and some other lollies. I stuffed my face, and felt crook all the way home. He bought new footy boots for my eldest brother too, and an Art Union ticket for Mum. He must have had a beaut time up the RSA that day, I reckon.",
Art Union,1988,Rainshadow,JACKSON,105,,"When he failed ... to win Tatts or the Art Union, he took it as a personal slight ...",
Art Union,1965,Stand in the Rain,WATSON,111,,I bought art union tickets every pay-day.,
Art Union,"Dec 16, 1917",Great Adventure,,275,,[Seeing so many here in France in easy jobs] makes a man ... wish that he had stayed in New Zealand until drawn in the Art Union.,Carruthers
Art Union,"Sep 4, 1874",NZ Herald,,1,,[Advt] Art Union of Sewing Machines.Second Distribution. Fourteen First-ClassSewing Machines as Prizes. Value - OneHundred Pounds. Tickets - 10s. each.,
Art Union,1992,"Art of Alfred Sharpe, The",BLACKLEY,26,,"There have been 'art unions' of Racingsweeps - of fancy soaps, of books, offurniture & o ye gods & little fishes, ofcakes and confectionery here.",From 1888 SHARPE in Newcastle Morning Herald
Art Union,1960,Owls Do Cry,FRAME,73,,The Art Union? There was a theory that if you bought a ticket up north where the population was thickest you were sure to win a prize. The raffle? Tatts?,
Art Union,1877,NZ Parliamentary Debates,,XXV/245,,"Sweeps on horse-races and so-called art unions were increasing to an alarming extent, and in Westland more than in any other part of the colony.",
Art Union,"Dec 11, 1890",Otago Witness,,23,,"A gentleman in Christchurch, who had five tickets in the Dunedin art union in connection with the Art Gallery, received an intimation that he was the lucky drawer of five prizes... This is an experience unexampled in art union drawings anywhere in the world.",
Art Union,"Sep 25, 1890",Otago Witness,,23,,"For cool impudence, a book agent on the warpath with a valuable work in 55 parts is hard to beat, but if there is anybody who can ""go one better"" it is the art union lottery man with 20,000 tickets to sell at a shilling a piece. The book agent does his own bullying, and wheedling; the art unionist asks you to do it for him on a 20 percent commission. . . Accompanying this letter. . is a printed circular setting forth the merits of the engravings. ""It is certain,"" says the lottery man, ""that many a mind will warm with enthusiasm on becoming possessed of such admirable works of art, which are now placed within the reach of a discerning public at the trifling risk of one shilling.""",
Art Union,"Oct 16, 1935",NZ Free Lance,,20,,Wellington's best known seller of art union tickets declares that her job is still a most interesting one.,
Art Union,"Apr 19, 1879",Auckland Weekly News,,8,,The subscribers to the Ceramic and Crystal Palace Art Union will be glad to learn.. that their selections and prizes have been shipped in the Isle of Bute.,
Art Union,"Jan 2, 1904",NZ Observer,,7,,Two Parnell ladies.. have dropped each other's acquaintance over a quarrel about a ten-shilling art union prize.,
Art Union,"Aug 9, 1913",NZ Observer,,7,,"The secretary of a hospital bazaar committee was fined for submitting a prize cow as a fit prize for an ""art union.""",
Art Union,"Dec 24, 1924",Christchurch Star,,14,,Mr Smith.. is not charging anything for his open sesame to the winning of prizes in art unions.,
Art Union,"Jul 7, 1926",NZ Observer,,6,,"Our raffles, or miscalled Art Unions are doomed.",
Art Union,"Nov 27, 1926",NZ Dairy Produce Exporter,,60,,[Advt.] Positively the Last Art Union with a GBP5000 Prize List.,
Art Union,"Mar 13, 1935",NZ Free Lance,,50b,,"[Advt.] Grand GBP5,000 Alluvial Gold Art Union.",
Art Union,"Jul 17, 1939",Te Aroha Times,,3,,"I understand that the Government is absolutely against State lotteries and yet I have just taken a ticket in what is described as an 'art union' - and where the 'art' comes from I do not know...The visitor was informed that the application of ""art union"" was a survival from the old practice under which works of art were raffled.",
Art Union,1991,Kiwi,WOLFE,59,,Gambling was officially sanctified in 1961 when the old Art Union was renamed the Golden Kiwi.,
Art Union,"Jan 4, 1864",Marlborough Express,,6,,"The origin of the affair [ = a practical joke] was, we understand, in connection with the Art Union of last week.",
