Head Word,Date,Source,Author,Vol / Page,Edition,Quote,Notes
A & P,Apr 2002,NZ Memories,,35/62,,"[Hdg] A & P Shows... Photographs from the Gore A & P Shows 1892-1910... It was also an opportunity for the newspaper reporter to exhibit his best stock of florid prose, as these excerpts from the early years of the Gore A & P Show demonstrate.",
A & P,2000,Kokopu Dreams,BAKER,59,,Now it was fenced and grazed and smoke rose from a kitchen built onto a hall once used for A&P shows.,
A & P,Feb 2001,Growing Today,,66,,"These days a lot of kids grow up not even knowing what the A & P stands for - it's Agricultural and Pastoral - and think the Easter Show is just about dodgems, ferris wheels and candyfloss.",
A & P,"Jun 7, 1932",Oamaru Mail,,8,,It was resolved to suggest to the A. and P. Association that a shelter belt of trees be planted on the south side of the showgrounds.,
A & P,1889,Canterbury (NZ): its resources and progress,,10,,THE CANTERBURY A. & P.ASSOCIATION This Association was founded in the year 1863 ...,
A & P,1943,Pure Gold,HISLOP,33,,Mr. -- had won with his cattle and horses in various A and P. Shows in the South Island.,
A & P,1948,"Cunninghams, The",BALLANTYNE,68,,He ... mentioned the little girl who was lost at the A & P show one year and was found dead in a swamp; ...,
A & P,1948,"Run, Estate and Farm",SCOTTER,25,,... from the first show of the A. & P. Association in 1863 he was a member of the committee and gained prizes in both merino and long wool classes.,
A & P,1951,Canterbury Tales,CRESSWELL,82,,"Although this report lessened public dissatisfaction, the A.& P. Associations seemed determined to have the school under their management, ...",
A & P,1962,Country Occasions,SHARPE,92,,To a country worker ... the A. & P. show is always a little bewildering.,
A & P,1966,"Encyclopaedia of New Zealand, An",,I : 17,,An annual conference of A. and P. Associations ... is held under the auspices of the Royal Agricultural Society.,
A & P,1968,Remembered Trails,TOMLINSON,33,,My cousin Arthur took me to parties [in Gisborne c1909] and the A. & P. Show.,
A & P,1972,"Half-Gallon Quarter-Acre Pavlova Paradise, The",MITCHELL,44,,"Voluntary activity runs all, from church groups to those high points of the year, the races and the A. and P. shows.",
A & P,1980,"Personal Kiwi-Yankee Dictionary, A",LELAND,7,,A & P Show: The Agricultural and Pastoral Show. Local equivalent of a STATE FAIR. The major event in every region and nearly all businesses ... etc. close down for `Show Day'.,
A & P,1986,"Matriarch, The",IHIMAERA,42,,You took us to the A and P Show at the Showgrounds.,
A & P,1966,"Encyclopaedia of New Zealand, An",,I:16,,"The Auckland Agricultural and Pastoral Association, founded in 1843, was the first to be organised; ...",
A & P,1989,Awekotuku Tahuri,,103,,A and P Show: Agricultural and Pastoral Show b. Agricultural and Pastoral.,
A & P,1976,How to Get Lost & Found in NZ,McDERMOTT,108,,"... we were just in time to see what we would call a County Fair, the Hawkes Bay Agricultural and Pastoral Show.",
A & P,1981,Straight from the Shoulder,KENNERDY,33,,"New Zealand's 100 Agricultural and Pastoral (A&P) shows, beginning with Whakatane in October and ending in Auckland over Easter, have been under increasing pressure ...",
A & P,1951,Canterbury Tales,CRESSWELL,117,,Job Osborne was one of three brothers who arrived in the Province in the late fifties and the family have long been good supporters of the `A. & P.',
A & P,"Feb 10, 1986",National Business Review,,32,,[headline] A & Ps in crisis : Doldrums or profitable razzmatazz? In the face of mounting losses the Hawke's Bay Agricultural and Pastoral Society changed its attitude ... other A&P societies are doing likewise.,
A & P,1987,Oracles and Miracles,ELDRED-GRIGG,71,,... I must of looked like something from a sideshow at the A & P.,
A and P Association,1948,"Run, Estate and Farm",SCOTTER,25,,From the first show of the A & P Association in 1863 he was a member of the committee.,
A and P Association,1987,Showtime 100,ADSETT,100/9,,Showtime 100 was a splendid climax to a century of endeavour by the Manawatu and West Coast A & P Association.,
A and P show,"Aug 12, 1888",Egmont Star,,7,,A & P show: ladies' horses' leaping match.,
A and P show,"Nov 1, 1953",NZ Farmer,,19,,Perfect weather favoured the opening day of the Manawatu A & P spring show at Palmerston North ...,
A and P show,1962,Country Occasions,SHARPE,94,,The A & P show is an illustration of what can be attained when farmers do get together.,
A and P show,1976,Mostly a Farmer,WATERS,62,,On this occasion a County Chairman had been invited to open the A & P Show.,
A and P show,1981,Speaking a Silence,HUNT,38,,"That old brown car of ours, we got it at the A & P show.",
A and P show,1998,Three Sheep and a Dog,GORDON,27,,"Just as hunt, racing and football clubs were founded, so too were annual gatherings, such as dog trials, sports meetings and A & P shows, each bearing its district's name.",
A house,1976,Pacific Star,WILSON,165,,"Toward the Bowentown end ... I saw new cottages going up among the sand dunes, new beach houses, plasterboard baches, even one or two A houses.",
a over k,1988,"Dictionary of Kiwi Slang, A",McGILL,10,,"a over k being tipped upside down, rudely; short for `arse over kite'.",
A to Js,1985,Collins Compact Dictionary,,30,,A to J Appendices to the Journals (of parliament),nf. 1982 Collins Concise Eng.Dict.; nf. 1986 NZPOD
A-frame,"Mar 28, 1979",Otago Daily Times,,21,,"A-frame is absent, so are `beano' and `beaut' (as a noun), and `just the berries';",fide G. Griffiths
A-frame,Apr 1987,NZ Outlook,,50,,Before that he had a smaller A-frame shack a little closer to the river.,
A-frame,1987,After Z-Hour,KNOX,111,,"It's a lot like the house my mother's aunt has on Vancouver Island. An A-frame, with a loft above the living room that looks out over the garden.",
A-frame,2001,Ellie and the Shadow Man,GEE,137,,"They walked up to the A-frame, where Rain had made a banquet of rice and curried vegetables.",
A-frame,"Mar 15, 2003",Dominion Post,,F17,,"Another hut built in 1958 was blown down 10 years later. That led to an A-frame hut and then the present, somewhat bleak, structure in 1982.",
A-frame (pack),1988,"Hills, The",,6,,"The first tramping club was formed in 1919 and many more followed in the twenties. A hardy lot they must have been. Heavy leather boots studded with hobnails or clinkers on the soles, kidney-crusher' or A-frame packs, and canvasor cotton tents ... <i>Ibid.</i> 78 For instance [a past generation's] packs (or swags as somewould have been calling them) would be A-frame`kidney-bruiser, kidney-rotter, kidney-crusher' types with billies dangling off the back and tents lashed to the outside.",
A-tent,1898,Reminiscences and Experiences,MEREDITH,14,,"The Canterbury Settlement was just being formed [in 1850]. I think the fifth immigrant ship had just arrived, and most of the immigrants were clustered about the shore of Lyttelton Harbour, many of them in little A tents, some ofwhich were improvised with blankets.",
A.C.,"Sep 3, 1889",Chudleigh Diary,,367,,"In Wellington. It is settled that Major Gudgeon, a sargeant and six A.C. [Richards's note: Artillery Corps] go to the Chathams ... to run in the Te Whiti Maoris.",Poss. abbrev. of Artillery Corps. (The Armed Constabulary was integrated into a Police Force in 1886: but phs Chudleigh is keeping to an old familiar term.) Quote from 1950 edition.
A.C.,Jun 2002,NZ Memories,,No. 36: 58,,"With the creation of the New Zealand Constbulary Force in early 1877, the A.C. Force ceased to exist.",
A.C.,1888,Geysers and Gazers,WILLIS,6,,"... a glimpse of one of the old A.C. blockhouses in the distance, a remnant of old times.",
A.C.,1916,Soldiering in NZ,GASCOYNE,116,,"We, the 6th and 7th divisions, marched on the 13th [186?] for the road camp ... There was no reason for marching in such bad weather, but in those days the A.C. Force were supposed to be weather-proof, and to act when required as if they were bullet-proof.",
A.C.,1922,"NZ Wars, The",COWAN,2/261,,Tu-Patea pointed out ... the place where the body of the A.C. man was eaten ...,1983 edition
A.C.,1935,Hero Stories of NZ,,135,,"There were two Beamish brothers, who had only joined the A.C. Force a few months before the fight. <i>Ibid.</i> 176 There were two Beamish brothers, who had only joined the A.C. Force a few months before the fight.",
A.C.,1964,Settlers in Depression,NORRIS,27,,"With the transfer of the Armed Constabulary headquarters from Hamilton, this building, with much else of the A.C. buildings, was removed to Cambridge.",
A.C.,"Oct 26, 1972",Dominion,,13/3,,"Built from pit-sawn timber sawn at Opepe, the hotel was originally the A.C. wet canteen. It was first built there about 1870. ... The A.C. Baths, off Spa Road, mark the spot where tired members would bathe in the hot thermal stream from huts erected ... in 1889.",
A.C.,"Jul 26, 1862",Chudleigh Diary,,,,We struck the river opposite the A.C. house and came out 5 miles up the stream. Cooper and I had a swim and we were always in a state of bob.,1950 edition
A.C.,Jun 1999,North & South,,130,,"Those brooding volcanoes, the scalding sand felt at lake's edge, the hot water swims at the A.C. Baths and the omnipresent pumice were all daily reminders you were on a volcanic plateau.",
A.C.,1888,Round about NZ,PAYTON,143,,"Whom or whatever the A.C. (as they are generally called) were going to blow up I didn't enquire,but to my unscientific mind there seemed enough [dynamite] to start a small eruption.",
A.C.,"Sep 24, 1904",NZ Observer,,4,,At that time he was a member of the A.C. Force.,
A.C.,"Mar 26, 1887",Auckland Weekly News,,8,,The whole was constructed for or by the A.C. Force when in Taupo.,
A.C.,"Mar 28, 1885",Wairarapa Daily,,2,,Before the Native Minister removed the A.C.'s there was every chance of starting a butter and cheese factory at Pungarehu.,
A.C.,"Mar 28, 1879",Chudleigh Diary,,277,,"At the [Wellington] wharf a steamer was filling up with A.C. to go to Waimate, a Maori outbreak being imminent.",1950 edition
A.C.,1895,Forty Thousand Miles Over Land and Water,MRS VINCENT,106,,There are about fifteen of these A.C. stationed [in Auckland].,
A.C.,1895,Diary of Jonathan Roberts,,14,,If you darted straight among a number of private citizens the A.C.'s couldn't use their arms.,
A.C.,1935,Hero Stories of NZ,,138,,"And then the lads in blue, sixty of them (No. 5 Division, A.C.) came up at the double, with fixed bayonets.",
A.C.,"Jun 14, 1879",Auckland Weekly News,,15,,"A number of bedrooms, in which the A.C. were quartered. were at the same end of the building.",
A.C.,"Apr 24, 1862",Chudleigh Diary,,,,Had tea at an A.C. [a frequent use in the diary],1950 edition
A.C.,"Mar 28, 1879",Chudleigh Diary,,277,,"At the [Wellington] wharf a steamer was filling up with A.C. to go to Waimate, a Maori outbreak being imminent.",
A.C.,1885,Forty Thousand Miles Over Land and Water,VINCENT,106,,There are about fifteen of these A.C. stationed [in Auckland].,
A.C.,1888,Round about NZ,PAYTON,143,,"Whom or what the A.C. (as they are generally called) were going to blow up [in the Waikato], I didn't inquire.",
A.C.,1895,Diary of Jonathan Roberts,,14,,If you darted straight among a number of private citizens the A.C.'s couldn't use their arms.,
A.C.,1935,Hero Stories of NZ,COWAN,138,,"And then the lads in blue, sixty of them (No. 5 Division, A.C.) came up at the double, with fixed bayonets.",
A1 milk,"May 29, 2003",Dominion,,A9,,"[Advt] All of the regular milk we drink in NZ is a mix of A1 and A2 milk (about 70% A1 amd 30%A2), depending on the herds... It is only in the highly developed, intensively bred western herds that this incidence of A1 cows producing A1 protein in the milk has occurred - a genetic mutation following domestication.",
A2 animal,"Nov 22, 2002",Dominion Post,,C2,,About 30 per cent of New Zealand Friesian cows are pure A2 animals.,
A2 corporation,"Jun 20, 2005",NZ Farmers' Weekly,,20,,"A2 Corporation, the A2 milk proprietary business, is going back to its shareholders for another $5 million, just 15 months after its last major capital raising.",
A2 cow,"Oct 12, 2006",Dominion Post,,D4,,"Ridge Cream is made from the milk of certified A2 cows, with naturally occurring maximums of the protein betacasein.",
A2 milk,"Aug 27, 2003",Dominion Post,,C1,,"The supply of A2 milk in Australia and New Zealand was small, but growing.",
A2 milk,"May 17, 2003",Listener (New Zealand Listener),,19,,"Imagine if drinking a glass of milk a day was enough to ward off heart disease in later life. But only a particular kind of milk known as A2. [20]I'm not saying there's nothing in the A2 story... What I am saying, right now it is mischievous to say that A1 is bad for you or conversely to say that A2 is good for you, because the evidence is pretty well non-existent."" ...he fed A1 and A2 milk to mice and found that those on a diet of ordinary milk didn't get diabetes while many of those on a diet or ordinary milk did.",
A2 milk,"Nov 22, 2002",Dominion Post,,C2,,"The likely arrival of A2 milk on store shelves before Christmas will be the culmination of eight years of work for Corrn McLachlan... The exact launch date of A2 is not yet known, as processors who will produce the milk under licence to A2 are still finalising supply arrangements.",
A2 milk,"Apr 29, 2003",Dominion Post,,C1,,"[Hdg] Capital misses out on new A2 milk. Wellingtonians will miss out on new A2 milk in their supermarkets, for now at least... A2 Corp's founder and chief executive Corran McLachlin said it had been a struggle to get A2 on the market.",
A2 milk,"May 18, 2003",Sunday Star Times,,A10,,"[Advt] All of the regular milk we drink in NZ is a mix of A1 and A2 milk (about 70% A1 and 30% A2, depending on the herd). A1 and A2 refer to two different proteins in milk... Fonterra applied for a worldwide patent in September 2001 claiming that A1 may induce or aggravate neurological and mental disorders such as autism and Aspergers syndrome.",
A2 milk,"Nov 22, 2002",Dominion Post,,C2,,The likely arrival of A2 milk on store shelves before Christmas will be the culmination of eight years of work .. though the big consumer products manufacturer still has a licence for A2 milk.,
A2 milk,"May 28, 2003",Dominion Post,,C11,,"The Commerce Commission will have a closer look at complaints by Fonterra over the rival alternative milk A2... Fonterra has said that claims by A2 milk marketeer A2 Corporation about the ""dangers"" of mainstream A1 milk were false and misleading, and that A2 products contained more A1 milk than disclosed in the products... A2 milk contains A2 beta casein and has been offered in supermarkets at a premium price since last month.",
A2 milk,"May 29, 2003",Dominion,,A9,,"[Advt] Broadly speaking, all traditional breeds of cows, buffalo, goats and sheep produce milk that can be defined as A2 milk... Therefore A2 milk can be termed the ""original"" milk, as nature intended.",
A2 milk,"Nov 22, 2005",Whakatane Beacon,,7,,"'A2 milk may potentially offer a better quality of life, which is particularly relevant to the Cook Islands where diabetes is a major health issue.'",
Aaron's beard,1961,Flora NZ,MARTIN,59,,The Usneas are sometimes termed AARON'S BEARDLICHENS.,Original edition 1929
AB,"Aug 19, 1999",City Voice,,15,,"Adidas could not have chosen a better time to sponsor the Abs, but ""black is thicker than blood.""",
AB,"Aug 8, 1999",Sunday Star Times,,B4,,[Hdg] ABs turnaround good reason for Boks optimism.,
AB,"Oct 6, 1999",Dominion,,41,,[Hdg.] ABs have the goods.,
AB,"Nov 3, 1999",Independent Business Weekly,,24,,"The feeling is that if a brand has portrayed the ABs as winners there is a problem, but if the emphasis has been more on the Abs as rolemodels, it's not so bad.",
AB,"Nov 8, 1998",Sunday Star Times,,B2,,"We need to work on a few basics like tackling and getting body position right, otherwise the ABs will be done like a dogroll at the World Cup.",
AB,"Oct 11, 1999",Evening Post,,4,,I think it's time to pick an All Black team from the form shown by the talent still on display in the NPC while the real Abs are at the World Cup.,
AB,"Jul 9, 2002",Dominion Post,,D8,,"It's becoming increasingly fashionable to refer to them as ""the ABs"", especially among those on the outer circle of rugby who'd desperately like to be in the inner circle... Sport can sometimes be the theatre of the absurd and that would increase if the shortening craze caught on. The national cricket team would become known as the BCs, the netballers as the SFs, the soccer players as the AWs, the basketballers as the TBs.",Ron Palenski
AB,"Jul 18, 2002",Dominion Post,,B6,,It rather pleased me.. to see that at least one other person seems to share my utter distaste for the current trend to refer to the All Blacks as ABs.,
AB,"Aug 30, 2000",Norwester,,2,,"[Hdg] Are the ABs becoming the ARs? Perhaps the All Blacks, aka the Abs, should be more appropriately named the Ars, also the Also Rans.",
AB,"Feb 24, 2011",Rugby News,,11,,He wants his AB's jersey back and he wants it bad.,
AB,1988,"Dictionary of Kiwi Slang, A",McGILL,9,,"AB a woman's period, short for `Annie Brown'; eg `I'll have to cry off tennis today, Maureen. Old AB's visiting.' [Shepard]",
Ab,Jun 2004,North & South,,85,,"Abs were the ubiquitous backbone of New Zealand rail when I was a child, they were the workhorses and were everywhere and are precious because they are so much part of New Zealand's rail heritage.",
AB,"Oct 17, 1970",NZ Dairy Exporter,,17,,"A week before AB starts, allow the marker bulls to run with the herd.",
AB,"May 2, 2002",Taranaki Daily News,,18,,"Dairy Insight will want at least $10, AB, herd-testing, shed power, shed expenses and animal health will take out the best part of $100 [per cow] ...",
AB,"Oct 31, 2002",Opunake and Coastal News,,14,,With most rotaries if you want to do AB straight after milking you have to close the plant down. An extra water gland means you can put the water through whilst the platform is going and do AB at the same time ...,
AB man,Oct 1970,NZ Dairy Exporter,,14,,"They're just a mob of cows, but each one must be an individual to the AB man and the farmer.",
Abbotsford mudstone,Jul 1967,Geological Society of NZ Newsletter,,23/8,,"It is hardly necessary to say that for almost all readers, it is much more important to know whether a certain area is underlain by say Abbotsford Mudstone or Caversham Sandstone, than it is to know the stage or series in the New Zealand time-stratigraphic system of nomenclature.",
ABC,"Jul 1, 1911",NZ Truth,,6,,... he knew that Scott and Martindale were A.B.C.; he had seen A.B.C. on their double boards at the races. ... A likely symbol for bookmakers to have? - Yes. It might be `All Bets Cash?' - Yes.,
ABC,"Aug 26, 1911",NZ Truth,,6,,His Worship: How do you know that `ABC' means `All Bets Cash?' Chief Detective Broberg: Mr. Wilford probably intends to call evidence on the point.,
ABC,"Oct 29, 1999",Dominion,,21,,It's enough to make you want to join the ABC (Another Bloody Chardonnay) brigade.,
ABC,"Feb 23, 2002",Dominion Weekend Magazine,,7,,"But what members of the ABC (Another Bloody Chardonnay) Club tend to overlook is that an astonishing number of those we do produce are, as Mr Simic suggests, very smart wines.",
ABC,Aug 2007,North & South,,119,,"Hudson is an ABC (""anything but chardonnay"") girl when it comes to everyday drinking ...",
ABC,"Apr 27, 2002",Listener (New Zealand Listener),,44,,Now we have the ABC drinkers: anything but chardonnay.,
ABC,"Sep 21, 2002",Dominion Post,,F7,,"Pinot gris' sassy little sister, pinot blanc, waits in the wings as the next ""ABC"" (anything but chardonnay) variety to hammer away at queen chardonnay's foundations.",
Abdul,Dec 1916,Roll Call,,6,,"Some stole away for a few minutes to visit the grave of a comrade for the last time, and to pencil in again his name on that little rough wooden cross; others thought of home, while the more hilarious ones wrote polite notes for Abdul and left them in dug-outs, thanking him for being a gentleman and a fair fighter.",
Abdul,1967,Shanties,BAILEY & ROTH,115,,"Old Abdul under cover was as cunning as a rat;/ As yet we'd done no shootin' - saw nothin' to shoot at,/ Till a Turkey popped his head up; that head he ne'er withdrew,/For a rifle pinged...",Original dates from 1915-1918
Abdul,1916,"Anzac Book, The",BEAN (ed),48,,"A real Abdul 'ad come up this time, and it wasn't no bloomin' donkey, either. ... one more bloomin' Abdul 'ad gone to join 'is Prophet.",E.A.M.W. 'The Dag'
Abdul,"Jul 1, 1918",Quick March,,11,,"All `old inhabitants' of Gallipoli will remember the armistice in May, 1915 ... Now, Abdul had a plentiful supply of bread, which we sadly lacked ...",
Abdul,"Aug 1, 1918",Quick March,,11,,"THE N.Z. `CAMEL CUP.' ... While back at the base,resting after chasing Abdul across the Jordan, we organised a Sports Meeting.",
Abdul,1938,Nor the Years Condemn,HYDE,167,,"`Fred, [168] remember that big fat Abdul who used to chuck the privates out of Shepherd's [in Cairo, WW1]. ... All the boys said that Abdul must'a been a eunuch.",
Abdul,1944,NZEF Times,,"18, 8:4",,"`Igri, George' - for every `Wog' is George or Abdul, just as the private soldier is either George or Johnny to the `Wogs'",
Abdul,"Apr 2, 1986",Dominion,,10,,Heath Cartoon [An Arab holding a newspaper headlining `World Oil PricesPlummet' looks through the window of `ABDUL CARMART' at a Volkswagen],
aboard,1950,Otago Interval,WHITWORTH,48,,... specially when he had a few aboard.,
abolition,"Jan 3, 1865",Daily Southern Cross,,5,,"..to revise the constitution in order to meet the requirements of the altered circumstances of the people, by giving each island a separate parliament, and by the utter abolition of all Superintendents and Provincial Councils, which are the curse and hindrance to the prosperity of these islands, under the present ill-adapted constitution,..",
abolition,"Aug 2, 1875",Daily Southern Cross,,3,,"A private message from Wellington states that it is reported in Wellington that Mr R wood has seceded from the abolition party, although professing to be a strong abolitionist.",
abolition,"Nov 20, 1867",West Coast Times,,2,,Our scheme for the constitution and government of New Zealand is founded upon the entire abolition of the provinces as separate entities.,
abolition,"Nov 6, 1874",West Coast Times,,2,,"The resolutions for the abolition of the provinces have been before the country for nearly three months - since the 12th August..In Auckland, Taranaki, Wellington, Nelson, Westland,Canterbury, Otago, in short, in every province of New Zealand, resolutions in favor of a total abolition of the provinces have been carried by acclamation. At the last election that took place, the successful candidate was an abolitionist,..",
abolition,"Aug 21, 1866",Nelson Examiner,,4,,"He would have it understood that he was no provincialist, but that on the contrary, he was an advocate for their abolition and the establishment of one strong central government.",
abolition,"Apr 3, 1865",Daily Southern Cross,,6,,"Although I, with very many others, would advocate the entire abolition of Provincial Government, yet while it is to last, further separation seems both desirable and necessary.",
abolition,"Sep 7, 1864",NZ Spectator,,3,,"The enemies of Provincial institutions encouraged the formation of new provinces, in order to let the evils of the system be more generally felt and thus by the increase of what they believed to be bad in itself, lead to its final abolition.",
abolition,"Aug 2, 1875",Richmond-Atkinson Papers,,2 Aug 2/398 (A.S.,,The abolition policy ...[sic] embodied in the Abolition of Provinces Bill seems quite in the ascendant.,1960 edition
abolition,1947,"Story of Canterbury, The",REED,197,,"Canterbury ... was one of the provinces that favoured abolition, but, says Alan Mulgan, `the Canterbury abolitionists ... counted upon the province being left with its land fund after provincial government had gone.'",
abolition,2003,Penguin History of New Zealand,Michael King,210,,One of the functions of provincial governments...was the provision and support of schools. Abolition meant that this responsibility had to be taken over by central government.,
abolition,"May 3, 1867",Daily Southern Cross,,4,,"Now, that which is simply meant by the apparently rather uncouth expression of destruction, or abolition, of legislative provincialism, really amounts to no more than functional abridgement.",
abolitionist,"Apr 17, 1875",Otago Witness,,9,,"He was not opposed to the abolition of Provinces provided satisfactory terms could be made, but he was not an abolitionist at any price.",
abolitionist,"Jun 23, 1875",Evening Post,,2,,".. at next general election he will, if necessary, leave Timaru, which is considered certain to return an Abolitionist, and contest a seat with one of the leading members of the Provincialist party.",
abolitionist,"Nov 6, 1874",West Coast Times,,2,,"The resolutions for the abolition of the provinces have been before the country for nearly three months - since the 12th August..In Auckland, Taranaki, Wellington, Nelson, Westland, Canterbury, Otago, in short, in every province in New Zealand, resolutions in favor of a total abolition of the provinces have been carried by acclamation. At the last election that took place, the successful candidate was an abolitionist.",
abolitionist,1876,Address to the People of Otago,MACANDREW,,,[Applied as a parochial insult to Vogel and his supporters of the abolition of Provincial Councils. get cit.],
abolitionist,1947,"Story of Canterbury, The",,197,,"Canterbury ... was one of the provinces that favoured abolition, but, says Alan Mulgan, `the Canterbury abolitionists ... counted upon the province being left with its land fund after provincial government had gone.'",
