Head Word,Date,Source,Author,Vol / Page,Edition,Quote,Notes
annual draft,"Jul 16, 1945",NZ Journal of Agriculture,,51,,"The products of this type of farm are wool, some store lambs, and a few fat wethers and store cattle, and last, but not least, an annual draft of cast-for-age ewes.",
annual draft,1969,Big Country of the North Island,NEWTON,48,,Homewood itself has annual drafts of up to 600 bullocks.,
annual draft,"Mar 23, 2002",Hawke's Bay Today,,29,,Annual draft of top shifting high country calves.,
annual draft,"Apr 20, 2002",Hawke's Bay Today,,28,,Annual draft of top quality hill country cattle to be drafted.,
annual draft,"Nov 2, 2002",Taranaki Daily News,,31,,.. these cows have been run with bull and include annual draft lines of Hasler Brothers ...,
Antarctic prion,1957,Dictionary of the Maori Language,WILLIAMS,442,,"<i>Totorore, ... 2. Pachyptila desolata Antarctic prion (dove prion). </i>",
Antarctic prion,1970,Annotated Checklist of Birds of NZ,,25,1980,"<i>49. a. Pachyptila desolata desolata</i>(Gmelin, 1789)<i> Antactic Prion</i> Breeding Kerguelen and Macquarie Islands ... rare in the Tasman Sea [?omit as Macquarie outside limit]",
ante (up),1873,Wild Will Enderby,PYKE,3/v/89-90,,"Guess they're going to lead a fresh suit now ... [90] Don't suppose they'll ante up to these galoots, so I'll jest take another hand myself.] <i>Ibid.</i> 3/viii/99 Well, now, I guess the plant ain't sprung; though for the matter of that I'd ante up every ounce of gold to have saved poor Harry, I would, Sir.",
ante (up),1904,Sons o' Men,LANCASTER,98,,"Look here; you anti them [ = missing sheep] up, at once. <i>Ibid.</i> 190 I'll anti up the low-sider [ = railway truck]. [?get longer context]",
ante (up),"Jun 24, 1905",NZ Truth,,1/5/0,,... `ante up' their silver to support the cute Yankee person.,
ante (up),"Jan 18, 1908",NZ Truth,,135/1/3,,"There is a `tight' in the affairs of man [sic], which taken at the flood leads on the `rising'- if you haven't 5s toante-up.",
ante (up),1914,Tale of Timbertown,GRACE,114,,"Where's the key? You young imp, anty up.",
Anti-Land Selling League,1983,Illustrated History of Taranaki,LAMBERT,34,,The Anti-Land Selling League was formed which solemnly pledged to fight to the death to retain ownership of tribal lands.,
anti-Maori,1946,Some Modern Maoris,BEAGLEHOLE,30,,The pakehas in the district are definitely anti-Maori.,
anti-missionary,1988,Te Maiharoa,MIKAERE,79,,"Anti-missionary feeling was common to most North Island prophets after the wars, and it is likely that southerners held similar views.",
anti-Pakeha,1922,"NZ Wars, The",COWAN,1/147,,The anti-pakeha crusade was given its first expression in a great conference of the west-coast tribes held in 1854.,
anti-Pakeha,1940,Sir Donald Maclean,COWAN,110,,... to him ... fell the task of conciliating ... the anti-pakeha party ...,
anti-party-hopping,"Jul 31, 2004",Listener (New Zealand Listener),,21,,The trouble with the anti-party-hopping edict was always that you'd be backing the party over the individual... Anti-party-hopping lore would have it that both Winston's deserters and Jim Anderton should resign in these circumstances.,
anti-Pommyism,1928,New Zealand a Nation,AIREY,2,,"Nationality ... does not lie in `anti-pommyism' prejudice against British immigrants, because they say `choom'when they mean cobber.",
anti-poppy,"Dec 24, 1990",Listener (New Zealand Listener),,132,,"Maybe if those in a position to wield the anti-poppy scythe were less attached to society's idea of normality and were willing to acknowledge excellence we would have a stronger, more vital and open-hearted society.",
anti-rugbyism,"Dec 15, 2005",Dominion Post,,D3,,"Admitting to vehement anti-rugbyism in a land obsessed by it is risky, sinful even, given the religious fervour with which the game is worshipped.",
anti-Seddonism,"Oct 28, 1905",NZ Truth,,19/4/3,,get cit.,
anti-shouting law,1947,"Story of Canterbury, The",REED,184,,"The public-houses, too, were open, and considering that there was no anti-`shouting' law, the conduct of the voters was commendably restrained.",
anti-wowser,"Nov 29, 1913",NZ Observer,,4,,"To ride a buckjumping horse - why, it's almost anti-wowser!",
anti-wowser,"Nov 19, 1908",Wanganui Herald,,7,,"[Letter to the Editor, signed ANTI-WOWSER.]",
anti-wowser,"Jul 7, 1927",NZ Truth,,1,,"WOWSER, sayd a bishop, is a man with a prayer-book in one hand and a cooked balance-sheet in the other. And an anti-wowser has a race-book in one hand and a cooked cray in the other.",
Antipodean,1874,Edward Crewe,BAINES,20,,Presently on my road to town I fell in with two Maories. I was sitting on a hill side in the [Auckland] Domain when up came my two Antipodean aboriginals who ... shook hands ...,
Antipodean,1881,Poenamo,CAMPBELL,Bk3/1/123,,"Yet how vivid still the remembrance of that year of grace 1840 when I first learnt a `settler's experiences' on the Antipodean shores of Poenamo, with life's `young dream' all before me, ...",
Antipodean,1882,Brighter Britain,HAY,1/188,,"Moreover, [new-chums] have to learn the meaning of an Antipodean ganger's cry, `Double up, there! Double up!'",
Antipodean,1934,Spur of Morning,MULGAN,114,,"Something of the antipodean sun, wind, and soil was in the blood of this group of young people.",
Antipodean,"Mar 25, 1934",Na To Hoa Aroha,NGATA,3/145,,A decision to send a delegation to the Old Country was arrived at. ...What is the delegation going Home for?What is it to say to the Home producer of like food-stuffs? Some ass has said that it is a delgation of good-will to lay the position of the poor Antipodean dairy-man before his relative and talk to him of the`Empire' and `loyalty'!,
Antipodean,1938,Promenade,LANCASTER,252,,To annoy the solemn conclaves at Westminster with such squibs ... as constantly arrived from the Antipodes was not to be thought of ... Regrettably the Antipodean end of the correspondence was so consistently abusive that the Colonial Office was simply goaded into replies.,
Antipodean,1939,Primitive Polynesian Economy,FIRTH,xi,,"And since the Maori have for a century been participants in in an Antipodean variant of European civilization, my generalizations had to be mainly reconstructions ...",
Antipodean,1945,Dictionary of the NZ Language,MARSH,35,,His accent was slightly antipodean.,=Australasian
Antipodean,1948,Julius Von Haast,VON HAAST,65,,"The career of an Antipodean geologist, honoured by the great scientists of the Old World, cannot be adequately described without some reference to these researches ... that established his fame as a savant.",
Antipodean,1980,"New Zealanders, The",HENDERSON,,,"... Poms in the 1960s were particularly bad at making mock of our quarter-acre section, ... our State Housing..., and above all our expression: `She'll be right'. (In a way, this is an Antipodean equivalent of the belovedEnglish: `Mustn't grumble'.)",
Antipodean,1985,Nest of Cuckoos,MARSHALL,24,,"Although he was ex-Hutt High, he now had an Oxford accent. He said his antipodean twang undermined his credibility with his patients.",
Antipodean,1986,Heroes and Sparrows,ROBINSON,123,,I certainly have no taste for the great antipodean pleasure of frolicking in the rips.,
Antipodean,1987,"Politicians, Public Servants & Public Enterprise",ROBERTS,24,,At the critical moment a breakthrough in technology made the exploitation of these factors practicable for theantipodean economy.,
Antipodean,"Jul 25, 1987",Listener (New Zealand Listener),,8,,Antipodean July How fiercely on the thin door/ the South Pole is thudding - /,
Antipodean,"Oct 3, 1987",Listener (New Zealand Listener),28,,,"To bring him back for the antipodean summer and duties with Otago, the local association would go cap-in-hand to the public.",
Antipodean,"Jan 10, 1989",Evening Post,,6,,"Those strangely infantile condensations - `prezzies' and `rellies' (for presents and relatives) were bandied about on the radio quite a bit recently. It looks as if they are going to join veges, ciggy, brekky, cardy - and all the rest as OK idiom. But there is one antipodean expression that charms people internationally ... That is the word `naughty', for sexual intercourse.",
Antipodean,1989,Chosen Place,,22,,"Now I ... have everyday `hassles', the same as my antipodean counterparts.",
Antipodean,"Nov 21, 1992",Listener (New Zealand Listener),,72,,The accounts are delivered with authentic antipodean eloquence.,
Antipodean,"Feb 23, 2002",Listener (New Zealand Listener),,62,,We two have fallen through earth's core / beached here on Mount Purgatory / blink back antipodean light / days on end.,Jan Kemp
Antipodean,"Aug 12, 1989",Listener (New Zealand Listener),,32,,"There was not a shred of the Antipodean about her, nor any of the hallmarks of the Antipodean Woman Abroad, - the tightly curled perm, twinset and pearls and bright magpie look which characterised all New Zealanders south of Balmoral.",
Antipodean,1875,Chowbokiana,HOOD,,,Chowbokiana: or Notes About theAntipodes and the Antipodeans [title],
Antipodean,1981,Hot & Copper Sky,STEWART,292,,She gathered that the company was at least relieved to find she did not ... talk like the Australian wartime prime minister ... whose raucous murdering of English [293] had given antipodeans generally a very bad name in England.,
Antipodean,May 1987,Metro,,59,,Some sort of cultural imperative caused the young women to board a ship ... and save ... for a tour of ... the Munich beer festival in the company of other Antipodeans in a Volkswagon campervan.,Roger `Auckland Life'
Antipodean,1987,MsCellany: Women Writers' Prose & Poetry,,,,"But his wife was bred in one of the oldest cities in the world, against which this antipodean upstart, changing rapidly from early colonialism to the modern, appeared raw, stark.",(Brooke-White)
Antipodes,Aug 2000,NZWords,,4 : 1,,"In geographical terms <i>the Antipodes</i> was always more appropriately used of New Zealand than of Australia (the true Antipodes of London, for example, being east of New Zealand).",
Antipodes,1832,Narrative of a Nine Months Residence in NZ,EARLE,74,,I could not help thinking ... whether this was a way to receive a countryman at the Antipodes.,1966 edition
Antipodes,"Dec 19, 1835",Voyage of the Beagle,DARWIN,401,,These Antipodes call to one's mind old recollections of childish doubt and wonder.,1845 edition
Antipodes,1836,Fugitive Verse of NZ,FILDES,42,,"[poem] `The Married Antipodes' [with epigraph] `To my wife in London, by the Winds overland, from the Antipodes'",United Service Journal (MS:VUW Library)
Antipodes,"Mar 15, 1839",Speeches & Documents,,8,,...at the Antipodes ....colonising N. Zealand.,Sir James Stephens's minute
Antipodes,1940,Rakiura,HOWARD,388,,"... she sported a body garment of recent date called `Polka jacket' by modistes and I believe, not yet quite abandoned by her civilised sisters of the Antipodes - ...",Acheron Journal in 1940
Antipodes,Feb 1860,Gatherings of a Naturalist,BENNETT,,,,->[passim - frequent]
Antipodes,"Feb 12, 1854",Auckland Journals,LUSH,153,,We seem at the Antipodes to go upon the opposite track to what people take in England.,1971 edition
Antipodes,1863,First Year in Canterbury Settlement,BUTLER,ch x/145,,[?NZ] People do not leave England and go to live at the antipodes to work for the same wages which they had at home.,
Antipodes,1863,"Vacation Tour at the Antipodes, A",HEYWOOD,,,A Vacation Tour at the Antipodes [title],
Antipodes,1867,Station Life in NZ,BARKER,146,,"I must tell you an incident of it, to show you what babies grown-up men can be at the Antipodes.",
Antipodes,1974,"Poems, The",CLOUGH,93,,And the Antipodes too have a Bothie of Tober-na-vuolich.,Clough `The Bothie of Tober-na-vuolich' oRIGINALLY C18??
Antipodes,1871,Knocking About in NZ,MONEY,4,,"Except that the hills in the background are not equal in height to those at the Antipodes, one or two of the small towns on the coast of Cornwall ... would give a very good impression of the picturesque little town of Lyttelton.",
Antipodes,1873,Wonderland of the Antipodes,TINNE,,,Wonderland of the Antipodes [title] <i>Ibid.</i> 43 ... some residents in Tauranga ... think their own little town is destined to become the `hub of the Antipodes' ...,
Antipodes,1874,Edward Crewe,BAINES,iii,,"In the course of an eventful ... life, during a long residence at the Antipodes, it had often been my lot ... to turn to very many occupations ... <i>Ibid.</i> iv. Mr. Edward Crewe was at the Antipodes for eighteen years, and then in ---- ah! well, I shall begin with New Zealand ... <i>Ibid.</i> 225. ... ask the next Australian or New Zealand colonist you chance to meet, and ... listen with misgiving to his personal bush experiences: he has only been a `new chum,' a travelling swell, or a counter-jumper, when at the Antipodes.",
Antipodes,1874,Crusts: a settler's fare due south,KENNAWAY,9,,"Two days later we anchored ...; the next we left the ship, slept upon the new and almost unpaced ground of the antipodes - and our experiences as colonists began.",
Antipodes,1879,Austral English,WALLACE,i:4,,"New Zealand, almost the Antipodes of New Zealand.",[OED2
Antipodes,1887,Taken In,HOPEFUL,116,,... the butchers' shops which at home are a grand sight at this time ... were quite otherwise at the Antipodes ...,
Antipodes,1902,Brett's Colonists Guide,,10,,... their Old Country experience is found to be leading them into making wrong deductions ... the following pages will assist in stating matters as they exist at the Antipodes.,
Antipodes,1911,Selwyn,BOREHAM,89,,... the enormous influence which Bishop Selwyn exerts upon the religious life of our own day as a direct outcome of these early experiments at the Antipodes.,from British or European point of view
Antipodes,1916,Light and Shade,M AND N ROSS,177,,"The men from the Antipodes have brought with them a humour and a slang of their own. Their definition of the various batches of volunteers is worth quoting. The first contingent became known as `The Tourists' ... . The came `The Dinkums' ... then ... `The Super-Dinkums', `The War Babies' and `The Hard Thinkers', the latter having thought a great deal before they came.",
Antipodes,1934,Journalese,HYDE,177,,"Whilst America still released its films in dime stores, we of the Antipodes could boast honest-to-goodness picture houses.",
Antipodes,1934,Children of the Poor,LEE,10,,In those days Antipodes meant more than `down under.' The term imaginatively suggested the edge of the world.,1949 edition
Antipodes,1935,"Little Country, The",GUTHRIE,102,,Descendants of the first generation of settlers ... werechagrined to find a certain disappointment among theiryoung cousins at Home because the skins of the visitors from the Antipodes were the same in colour as their own.,
Antipodes,1936,Recollections of an Amateur Soldier,TREADWELL,86,,"The New Zealand troops were unknown to the populace ..., and the tall spare figures from the Antipodes caused a lot of open comment.",
Antipodes,1938,Promenade,LANCASTER,15,,"At least there will be laxity in the Antipodes, thought Jermyn, seeing himself gathering up Maori wives by the dozen ... <i>Ibid.</i> 252. To annoy the solemn conclaves at Westminster with such squibs ... as constantly arrived from the Antipodes was not to be thought of ... Regrettably the Antipodean end of the correspondence was so consistently abusive that the Colonial Office was simply goaded into replies.",
Antipodes,1948,Julius Von Haast,VON HAAST,6,,"It was not with a feeling of exultation that Haast pulled up his roots in Germany and prepared to transplant himself to the Antipodes, ...",
Antipodes,1963,Armed Settlers,NORRIS,58,,To own one's own home was a goal which brought many a craftsman to the Antipodes.,
Antipodes,1976,"Pagan Game, The",SLATTER,108,,George Webster who dreamed of becoming a Mr Chips of the Antipodes.,
Antipodes,1976,Sunset Village,SARGESON,34,,"Then too there was that word - and Brixton knew that Antipodes meant opposite feet, ...",
Antipodes,1978,New Oxford Book of Light Verse,W. VAUGHAN-THOMAS,274,,"Super suburbia of the Southern Seas,/ Nature's - and Reason's - true Antipodes,/",c1956
Antipodes,1983,Rutherford Simple Genius,WILSON,91,,[Of Ernest Rutherford] a rabbit here from the antipodes who burrows mighty deep.,
Antipodes,1982,Collins Concise English Dictionary,,45,,antipodes ... 3. (often cap.) the. Australia and New Zealand.,1986 NZPOD 28; 1985 Collins NZ Compact Dict. 20]
Antipodes,Aug 1986,Islands,,37 : 33,,"He was also a virgin who had lied about his age that he might embark on the great adventure of Hitler's war, as it seemed to many in the Antipodes.",
Antipodes,1986,Landfall,,158 : 190,,`Summer 1967' though in the antipodes it's always ambiguous/ which summer you mean when you supply one year only.,
Antipodes Island parakeet,"Dec 4, 1907",Evening Post,,8,,"The birds include the Antipodes and Auckland Island parakeet and the flightless duck, and they will be removed to the Kapiti Island bird sanctuary... The Antipodes parakeet is one of the rarest birds in the world, and is confined to an islet three miles long by 1 1/2 miles wide.",
Antipodes Island parakeet,1892,TrNZI,,24/64,,<i>Platycercus unicolor.</i> (The Antipodes Island Parrakeet.),(Buller)
Antipodes Island parakeet,1923,NZ Journal of Science & Technology,,6/86,,<i>Cyanorhamphus unicolor Lear. Antipodes Island Parrakeet. Captain Bollons writes (1923) that this species is quite numerous. </i>,Myers Endemic Birds
Antipodes Island parakeet,1966,Birds of New Zealand,FALLA et al.,177,,ANTIPODES ISLAND PARAKEET <i>Cyanoramphus unicolor </i>,
Antipodes Island parakeet,1970,Annotated Checklist of Birds of NZ,,50,1980,"<i>220. Cyanoramphus unicolor</i> (Lear, 1831) <i>Antipodes Island parakeet </i>",
Antipodes Island parakeet,1985,Reader's Digest Book of NZ Birds,,250,,"<i>Antipodes Island Parakeet Cyanoramphus unicolor</i> (LEAR, 1831) ... OTHER NAME: <i>Antipodes green parakeet. </i>",
Antipodes Island snipe,1970,Annotated Checklist of Birds of NZ,,49,1980,"<i>172.d. Coenocorypha aucklandica meinertzhagenae </i> Rothschild, 1927 <i>Antipodes Island Snipe </i>",
Antipodes pipit,1985,Reader's Digest Book of NZ Birds,,270,,"<i>Pipit Anthus novaeseelandiae</i> (GMELIN, 1789) ...<i> New Zealand Pipit A.n. novaeseelandiae</i> (GMELIN, 1789). <i>Auckland Islands Pipit A.n. aucklandicus</i> GRAY, 1862. <i>Antipodes Pipit A.n. steindachneri</i> REISCHEK, 1889. ... OTHER NAMES: <i>Pihoihoi, groundlark, native lark. </i>",
Antipodes pipit,1970,Annotated Checklist of Birds of NZ,,65,1980,"<i>246.c. Anthus novaeseelandiae steindachneri</i> Reischek, 1889 <i>Antipodes Pipit <i>",
antler fern,1905,My NZ Garden,WHITE,54,,"[pseud. a Suffolk lady] Fern-seekers would have little or no sport in the depths of the Bush, but just inside, it is deeply carpeted with Ferns, sometimes interspersed with Antler-fern (<i>Lycopodium volubile</i>), spreading its creeping stems over 10 feet in length.",
anuhe,1904,"Maori Race, The",TREGEAR,86,,"... careful watch was also kept upon the growing plants to guard them from the ravages of a certain caterpillar; the larva of a large moth (<i>anuhe, awhato, hotete</i>; Cordiceps robertsii) which preyed on the kumara leaves ... This pest is better known as the `vegetable caterpillar' from a fungus that grows from it after death.",
anuhe,1929,Whitcombe's Etym. Dict. Aust-NZ Suppl.,,Suppl. 1,,<i>Anuhe n.</i> a large caterpillar that feeds on sweet potato leaves. see VEGETABLE CATERPILLAR. [Maori],
anything like,1949,Personal Communication,,,,If he was anything like he'd give us a basketful. [generous],
anything like,1951,Personal Communication,,,,If he was anything like he'd have stuck up for himself and not depended on me. Wellington,
anythings,1981,History of Children's Play,SUTTON-SMITH,269,,"Here are some [marble] terms from Taranaki around 1880-1890: firsts, lay-up, stakes, tips, sticking-taw, nothings, anythings, fade-it, knuckledown stiff, dubs, finking [sic, ?funking], sips, spanning, placing; and from Dunedin School in 1949: knee high, manyies, tracks, screws, nuts, sleets, kills, forces, dig, dubs, cheats.",
ANZA,"Nov 20, 2002",Dominion Post,,A12,,"Now he's picking that 4WD advertiswers will adopt some self-regulation, through the Association of New Zealand Advertisers (Anza). He said Anza was in the early stages of consultation over the 4WD advertising environmental issue with industry, government and the community...",
ANZAAS,1982,Collins Concise English Dictionary,,46,,A.N.Z.A.A.S. abbrev. for Australian and New Zealand Association for the Advancement of Science.,nf. 1986 NZPOD
Anzac,"Oct 7, 2000",Listener (New Zealand Listener),,8,,"A joint currency between Australia and New Zealand... should be called an Anzac: Australia and New Zealand Amalgamated Currency; and then, in the course of time, it would be shortened to ""zac"", which was old slang for sixpence - but let's hope the current exchange-rate plunge doesn't take us to that depth!",
Anzac biscuit,"May 10, 1997",Listener (New Zealand Listener),,67,,"Between midnight and 5.00am, I ate four large Anzac biscuits and drank three cups of tea...",
Anzac biscuit,"Aug 17, 1999",Evening Post,,3,,"Anzac biscuits, the oaty, golden syrup treats, are to be covered in chocolate to become the official biscuit of the millennium.",
Anzac biscuit,"Apr 25, 1999",NZ Catholic,,17,,"Photos taken in New Zealand during the early years of the First World War show women selling cakes and biscuits including a plate with the sign ""Anzac Biscuits.""... New Zealand Anzacs... Melt butter and golden syrup over a gentle heart until melted. Combine oats, sifted flour, sugar and coconut.",This article contains a history of the biscuits - see Harry's files.
Anzac biscuit,"May 13, 2000",Listener (New Zealand Listener),,50,,"The name of the biscuit says a lot about our national identity back in the 1920s, when recipes for Anzac biscuits were first published... One of the earliest biscuits to be given the name Anzac was not the recipe we use now, but one for a spicy rolled biscuit previously known as German biscuits. There were also Anzac cakes, which were a type of rock cake, and Anzac wafer was an ironic name for military hardtack.",
Anzac biscuit,"Nov 14, 1998",Listener (New Zealand Listener),,69,,"At the time, most restaurants were emulating the European styloe of cooking, Harley's menu pushed a New Zealand theme: Anzac biscuits, pipi fritters, pizza topped with tuatuas.",
Anzac biscuit,"Apr 24, 2002",Capital Times,,20,,"Anzac biscuits travel well because they contain no milk or eggs, so perhaps a few made their way to the Gallipoli beaches.",
Anzac biscuit,Jan 1992,NZ Geographic,,No. 13/19,,"The scones, pikelets, Afghans, Anzac biscuits and shortbread with which Sharon filled the biscuit tins on a Saturday had been taught to her by her mum, who in turn had learned them from her Scottish mother.",
Anzac biscuit,"May 13, 2000",Listener (New Zealand Listener),,50,,"One of the earliest biscuits to be given the name Anzac was not the recipe we use now, but one for a spicy rolled biscuit previously known as German biscuits. There were also Anzac cakes, which were a type of rock cake, and Anzac wafer was an ironic name for military hardtack.",Article summing up history of Anzac biscuit in this issue of the Listener
Anzac biscuit,1999,Long Hot Summer,ANDERSON,94,,"She smiles, offers him an Anzac biscuit.",
Anzac biscuit,1992,Underrunners,MAHY,19,,"I made a batch of Anzac biscuits, butthere are too many for Rosie and me toeat on our own.",
Anzac biscuit,"Jan 17, 2004",Dominion Post,,E12,,"Tea, home-made Anzac biscuits and conversation help while away the hours.",
Anzac biscuit,"Mar 20, 2002",Dominion,,9,,"[Caption] Returned servicemen Boyd Klap, of Wellington, inspects a batch of Anzac biscuits on navy frigate Te Kaha at the announcement yesterday that the fundraising biscuits were to be made by an Australian company.",
Anzac biscuit,"May 22, 2004",Listener (New Zealand Listener),,41,,I don't think that there is such a thing as a standard Anzac biscuit.,
Anzac biscuit,1936,Cookery Book of NZ Women's Institutes,,153,,"Anzac Biscuits. Melt 1/4 butter, 1 tablespoon syrup, add 1 teaspoon soda, dissolve in 2 tablespoons boiling water. Add 1 cup wholemeal, 1 cup dessicated coconut, 3/4 cup flour, 1 cup sugar, 1 cup walnuts. Roll in hands into little balls. Bake 1/2 hour in slow oven.",Also in 1955 edn p.108
Anzac biscuit,1939,Aunt Daisy's Cookery Book,BASHAM,107,,ANZAC BISCUITS ... butter ... golden syrup ... baking soda ... boiling water ... sugar ... cocoanut ... wheatmeal ... walnuts ... flour ... roll into small balls ...,
Anzac biscuit,1980,"Personal Kiwi-Yankee Dictionary, A",LELAND,9,,ANZAC biscuit : A COOKIE MADE OF rolled OATS and COCONUT. CARE packages sent to first world war NZ troops always included some of these.,AND 1977 : more cit to come from cookery books
Anzac biscuit,1929,Ideal Cookery Book,,122,,ANZAC BISCUITS ... butter ... golden syrup ... baking soda ... boiling water ... Oatina ... dessicated cocoanut ... sugar ... chopped walnuts ... flour ... Put teaspoonful on cold tray and bake ...,
Anzac biscuit,1933,Cookery,FINLAY,147,,"No. 562.- Anzac Biscuits, No. 1 ... 1 Br. cup wheatmeal, coconut, flour, ... brown sugar, ... walnuts, ... butter, ... syrup, ... water, ... B. soda, ...B. powder, ... salt. ... Mix dry ingredients. Melt syrup and butter with water and soda added and stir into dry mixture. Place spoonfuls on cold, greased trays. Bake...",
Anzac biscuit,1934,"Marigold Book of Recipes, The",,27,,"ANZAC BISCUITS ... butter ... sugar ... golden syrup ... B.Soda ... boiling water ... flour ... coconut ... Oatina ... chopped walnuts ... teaspoonful ... roll into a ball, flatten out, put on tray, bake ...",
Anzac biscuit,1936,Merry Meal Maker Cookery Book,,15,,ANZAC BISCUITS ... rolled oats ... cocoanut ... flour ... sugar ... chopped walnuts ... butter ... golden syrup ... boiling water,
