Head Word,Date,Source,Author,Vol / Page,Edition,Quote,Notes
akiraho,1982,Stewart Island Plants,WILSON,98,,"Cultivated Olearia in Halfmoon Bay: AKIRAHO (O. paniculata) is used as a hedge plant; it hasyellow-green, wavy-edged, white-backed leaves.",
akker/acker,"Oct 18, 1943",NZEF Times,,III/121 : 11,,"Naturally careful and acker-conscious, the shopper looked out his budget for the day.",
akker/acker,"Feb 16, 1945",NZEF Times,,IV/199 : 5,,"Few soldiers in Egypt use the word piastre... The almost universal Army term for them is ""akkers""... When soldiers found they would have to refer to their money as piastres, it did not take them long to substitute ""disaster""... It may have been a concert party gag at first.. to talk of owing a friend five ""accidents"", and the abbreviation to ""aker"" or ""akker"" - there seems to be no defined spelling - followed as a matter of course.",
akker/acker,1983,Down from Marble Mountain,HENDERSON,259,,"The most beautiful thing in a month atMaadi, I bought for two ackers,fivepence.",
akker/acker,1943,Passage to Tobruk,JACKSON,36,,"... the banker paid out two shillings, 100 drachm notes, a Jippo note for 50 accas ...",
akker/acker,"Aug 4, 1941",NZEF Times,,I/6 : 3,,"If your unit representative weighs over 16 stone you could risk an ""acker"" or two.",
akker/acker,"Jun 8, 1945",NZEF Times,,IV/308 : 3,,They apologised properly and produced from the other hand the akker they kept in readiness for such an eventuality.,
akker-happy,1946,Maleesh George,BRUNO,42,,"They were an acker-happy party. <i>Ibid.</i> 58 They were an akker-happy pair, who held ... that a man who bets is a goat ...",
akkers,Sep 1958,Tararua,,18,,"Bridge was the main serious(?) game at Scott Base ... A [table top] football game ... held sway for a while, till ludo or `Akkers' gripped the camp in a fever; with four boards going and the spectators and players hurling advice and abuse, ... but it was a great way of letting off steam.",Life in Antarctica
Al Capone,1982,"Big Huey, The",NEWBOLD,244,,AL CAPONE (n) Telephone.,
ALAC,"Dec 24, 2001",Evening Post,,7,,"According to an Alac (Alcohol Advisory Council) report, the biggest suppliers to minors are parents.",
ALAC,"Apr 23, 1983",Listener (New Zealand Listener),,10,,"A cancer research proposal to set up a quango called the Tobacco Products Council ""along the lines of the Alcoholic Liquor Advisory Council"" is such a naivety... The capture of Alac as a sort of marketing support group for the liquor industry would happen to any organisation set up in similar fashion to ""advise"" the tobacco industry.",
aLBa,"May 4, 2008",Express (Gay & Lesbian Express),,8,,".. if you are aware of any speakers within the GLBT or straight communities who would like to speak to aLBa on a topic of interest to lesbians, please feel free to give aLBa a call.",
albacore,1921,NZ Journal of Science & Technology,,IV : 118,,"GERMO GERMON (Lacepede[e1-acute, e2-grave]). Long-finned Albacore. ... Distribution: Known from Cook Strait, Napier, and Gisborne.",Phillipps Notes on the Edible Fishes NZJST June
albacore,1882,Brighter Britain,HAY,2: 230,,"We have, indeed, a wealth of fish in all the tidal waters. Sharks, schnapper, rock-cod, mackerel, mullet, herring, sole, halibut, albacore, barracouta, king-fish, and others.",
albacore,1918,NZ Journal of Science & Technology,,1 : 6,,"<i>Germo germon</i> (Lacepede[e1 grave, e2 acute]) ... (Long-finned albacore.)",
albacore,1927,TrNZI,,59 : 140,,<i>Germo germon</i> (Lacepede); Long-finned albacore,Griffin
albacore,1927,Bibliography of NZ Fishes,PHILLIPPS,46,,<i>Germo germon</i> (Lacepede); Long-finned albacore,1971 edition
albacore,1936,"Handbook for New Zealand, The",,72,,<i>Germo germon</i>: Long-finned albacore.,ANZAAS Conf. Jan. 1937
albacore,1955,Namelist,WHITLEY,409,,Albacore <i>Germo germon steadi</i> Whitley,in 1956 Graham NZ Fishes
albacore,1966,Sea Anglers' Guide,DOOGUE AND MORELAND,272,,ALBACORE ... Other names: <i>Thunnus alalungs</i>; germon.,
albacore,1967,Marine Fishes,MORELAND,50,,ALBACORE [<i>Thunnus alalungs</i>] ... Germon and longfinned albacore are alternative names.,
albacore,1986,NZ Fishes: An Identification Guide,PAUL,126,,Albacore <i>Thunnus alalungs</i> ... Albacore have a widespread distribution in tropical and subtropical waters,
albacore,1926,Angler's Eldorado,GREY,27,,One of the scientific booklets on New Zealand fish mentioned long-fin albacore up to two hundred pounds caught by market fishermen. These were undoubtedly the Allison tuna.,
albacore,1970,Nomenclature of NZ Fish,SORENSEN,9,,"ALBACORE (see also Tuna) (a) Scientific name: <i>Thunnus alaunga</i>. (b) Suggested commercial name: Albacore. (c) Other common names: Tuna, Tunny, long-finned albacore. (d) Principal localities where taken: Bay of Plenty, East Cape to Gisborne, North Taranaki Bight.",
albacore,1981,Fisherman's Bible,WILSON,19,,"ALBACORE ... Some confusion reigns as to this fellow's real name. As with many of our fish he has several. His scientific name can either be <i>Thunnus germo</i> or <i>Thunnus alalungs</i>, depending onwhich authority you believe. Common names include Southern Bluefin, Longfin-Tuna and Longfin Albacore. ...",
albacore,1987,Fishes: A Bibliography,PAUL et al.,,,"[index to common names 283-293] albacore 2056-9, 2094-8, 2107 ... Angler'S Eldordadoalbacore, longfinned 2056-8, 2094",
albacore tuna,"Jul 23, 1986",Codes for Species in NZ Waters,,,,"[species name] albacore .. [scientific name] <i>Thunnus alalunga </i>.. [other name(s)] tuna albacore, longfinned tuna, tunny",
albacore tuna,"Oct 2, 2004",Listener (New Zealand Listener),,61,,"In summer, the albacore tuna season will begin.",
albacore tuna,1982,Collins Guide,AYLING,291,1984,<i>ALBACORE TUNA Thunnus alalunga </i>ALLISON('S) TUNA,
albacore tuna,1981,Collins Guide,AYLING,WILSON,269,"The larger fish [Yellowfin tuna, <i>Neothunus macropterus</i>] with very large second dorsals and anal fins are often called Allison tunas, but it is considered that the two are identical and that the larger [270] finned fish are a growth stage of the Yellowfin. They are known as Yellowfin-albacore in some parts of New Zealand.",
Albany conglomerate,Jun 1974,Geological Society of NZ Newsletter,,37/14,,"Bunting, F.J.L. 1970. Albany Conglomerate in the Kaukapakapa-Wainui district. (N37, N38)",
Albany surprise,"Sep 7, 1985",Listener (New Zealand Listener),,59,,"Two diverting byways here are the storyof the origins of the ""Albany Surprise""grape, and of the ""diamond rush"" atRiverhead in 1899.",
albatross,Nov 2003,AA Directions,,No. 58/46,,"Most interesting are the varieties of albatross - gibson's, northern royals and southern royals.",
albatross,"Jan 28, 1773","Resolution Journal of J.R. Forster, The",FORSTER,2/220,,We saw a great Variety of bird this day viz. A white & sooty Albatross (Diomedea exulans & palpebrata).,
albatross,1863,First Year in Canterbury Settlement,BUJTLER,1/12,,"The great feature of the southern seas is the multitude of birds ... Huge albatrosses, molimorks (a smaller albatross), Cape hens, Cape pigeons, parsons, boobies, whale birds, mutton birds and many more, wheel continually about the ship's stern, ...",
albatross,1869,TrNZI,,1/161,,Diomedea exulans. Toroa. Albatross.,Hutton Birds Great Barrier
albatross,1870,TrNZI,,2/177,,The (so called) highland albatross (the noblest of all sea birds) lays but one egg in a nest raised about ten inches from the ground [on Campbell Island].,Hector Outlying Islands
albatross,1871,Birds of New Zealand,HUTTON,43,,118. DIOMEDEA EXULANS. L. Albatross. Torea.[sic:error for Toroa],
albatross,1892,Dictionary of the NZ Language,WILLIAMS,206,,Toroa ... albatross.,
albatross,1883,Ranolf and Amohia,DOMETT,1/307,,Albatross ..... Procellaridae; Diomedea exulans.,
albatross,1928,"Morioris, The",SKINNER AND BAUCKE,358,,... the most important [Chatham Island] edible sea-birds: AS WRITTEN AS PRONOUNCED ENGLISH hopo ho[macron]p' albatross hakoakoa ha[macron]ko[macron]k' mutton bird,Baucke Manuscript (Bishop Museum Memoirs Vol. IXNo. 5 pp. 343-382)
Albertlanders,Apr 2004,NZ Memories,,No. 47/69,,"[Advt] Printed in 1927 to mark the first 50 years of Albertland Settlement on the shores of the Kaipara Harbour the full story is told in ""The Albertlanders - Brave Pioneers of the 1880's"".",
Albertlanders,Feb 2003,NZ Memories,,No. 40/51,,[Hdg] The Albertlanders. The title 'Albertlanders' was given to the Nonconformist colonists who settled at Port Albert from late 1862 to 1863. The formation of the 'Albertland Christian Colonial Movement' was an idea devised by Englishman William Brame as a bi-centenary celebration of the expulsion of the Nonconformists from the Church of England. Approximately 3000 settlers left British shores to join the movement.,
alectryon,1906,Plants of NZ,LAING & BLACKWELL,,,,And
alectryon,"May 12, 1892",Otago Witness,,33,,"While waiting here we found the curious fruit of the Alectryon excelsum - sometimes styled the New Zealand ash, to which tree the foliage bears some resemblance. Our Maoris called it the topetope, but the recognised Native name is the titoki, or tokitoki, an instance of the varying names in different districts.",
alectryon,"Jul 1, 1901","Star, The",,1,,"The next medallion on the left descending is a portrait of his Excellency Lord Ranfurly the Governor of New Zealand, under which the ake ake and popohue blossoms terminating, a bloom of titoki - Alectryon excelsum (Goertner) is shown; this tree is found only in New Zealand.",
alectryon,1872,Ranolf and Amohia,DOMETT,1. 7/16,,"The early season could not yet/ Have ripened the alectryon's beads of jet,/ Each on its scarlet strawberry set. <i>Ibid.</i> 132 Alectryon [fn] Titoki",
alectryon,1883,Ranolf and Amohia,,132,,"The early season could not yet/ Have ripened the alectryon's beads of jet,/ Each on its scarletstrawberry set,/ <i>Ibid.</i> 302 Alectryon (Titoki) .....O. Coriariae; G Alectryon; S. A. excelsum. A fine large forest tree.",
alectryon,1898,Austral English,MORRIS,2,,"Alectryon, a New Zealand tree and flower, Alectryon excelsum, De C., Maori name Titoki q.v.; called also the New Zealand Oak, from the resemblance of its leaves to those of an oak. Named by botanists from Grk. ...",
alectryon,1961,Merriam-Webster Third International,,51,,"alectryon n, cap [NL, fr. Gk alektryon cock, fr. Alektryon, a name] : a monotypic genus of New Zealand trees of the family Sapindaceae with alternate compound leaves and showy paniculate leaves - see TITOKI",
alfonsino,1982,Collins Guide,AYLING,178,,"ALFONSINO <i>Beryx splendens</i> ... The alfonsino is a slender deepwater relative of the golden snapper ... The alfonsino is a beautifully coloured fish with a brilliant scarlet back, red flanks with a strong tinge of silver, and bright red fins.",1984 ed.
alfonsino,1987,NZ Fishes: An Identification Guide,PAUL,72,,Alfonsino <i>Beryx splendens</i> ... Widespread in many subtropical to temperate oceans. Brilliant red ...,
alfonsino,1987,Fishes: A Bibliography,,1016,,alfonsino <i>Ibid.</i> 1014-21 ALFONSINOS 1014-21,[index to common names 283-293]
alfonsino,"Apr 15, 1991",Listener (New Zealand Listener),,40,,"However, now we are using species such as warehou, alfonsino and hoki, which in earlier years were regarded, with some justification, as second-rate, I've found it necessary to extend my range.",
Ali Baba,"May 21, 1963",NZ Truth,,19,,"Then, on the way to the shovel, I'm so elephant's trunk, I drop me Gordon and Gotch in the ali baba. ali baba ... harbour",
Ali Baba basket,1980,NZ Truth,MANTELL,84,,... in the laundry an ali baba basket contained crumpled towels for someone's bath.,
alienate,"Oct 14, 1919",Poverty Bay Herald,,5,,"The chairman could be restrained by prohibition if the Board was acting without jurisdiction in confirming this alienation. Defendant's application for confirmation had been opposed by plaintiff, who, His Honor understood, did not then apply for confirmation. The real objection was that the Native transferrors [sic] purported to alienate the land before their own title by succession was complete.",
alienate,"Mar 28, 1870",Daily Southern Cross,,4,,"The victories of the mining companies at the Thames are at least as encouraging as those of the colonial forces in the Taupo district. Although the natives still refuse to alienate the lands on the Upper Thames for mining uses, yet from the fact that parties of them have received from the Provincial Government recently large sums for gold licenses on the lower river, it may be supposed that their patriotism or obstinacy will yield in time to the temptation of increasing their easily-acquired gains.",
alienate,"Sep 20, 1888",Wanganui Herald,,2,,"The Native Land Act.4. Subject to the provisions of ""The Native Lands Frauds Prevention Act, 1881,"" and of ""The Native Lands Frauds Prevention Act 1881 Amendment Act 1888,"" Natives may alienate and dispose of land or any share or interest therein as they think fit.",
alienate,"Oct 4, 1900",Poverty Bay Herald,,2,,"To permit such Maori to occupy the land for his maintenance and support, such land is to be absolutely unalienable, either to the Crown or any other person except with the consent of the Council, and no Maori shall alienate any land unless he is provided with a papakainga certificate.",
alienate,"Feb 6, 1840",Treaty of Waitangi,,,,... but the Chiefs ... yield to Her Majesty the exclusive right of Preemption over such lands as the proprietors thereof may be disposed to alienate - at such prices as may be agreed ..,
alienate,"Oct 20, 1841",GBPP,,1842 (No.569) : 185,,"AAA. Reserves ... that on Thorndon Flat is occupied by an extensive native pah, which the natives have not alienated ... The second was intended for a basin, an idea suggested probably by the swampy character of the ground around it; but besides that, such a project is of very questionable advantage; ...",
alienate,"Mar 13, 1854",Richmond-Atkinson Papers,,1 : 145,,"The natives here after many years' refusal to alienate any further portions of their land have given way at last, and the area of land available for European settlement in this Province [Taranaki] has just been augmented ...",C.W.Richmond. 1960 edition.
alienate,1856,New Zealand (various authors/titles),FITTON,14,,The native population at the present day are very unwilling to alienate any portion of the territories which have been reserved to them ...,
alienate,"May 8, 1860",Selected Documents,,108d,,There is reason to think that an independent right to alienate land without the consent of the tribe is unknown in New Zealand.,G.A. Selwyn Memorandum to Governor Gore Browne
alienate,1860,Maori King Movement,BUDDLE,20,,The land thus given over to the King is not to be alienated without his consent.,
alienate,1946,Where the People Sing,ZIMMERMAN,80,,"... for before the Maori can alienate the land, the consent of all his tribesmen who may have an interest in that land must be obtained.",
alienated,"Apr 12, 1862",Otago Witness,,7,,"Not injudiciously, we think, the General Government refused assent to an Ordinance passed through the Provincial Council last Session, empowering the leasing for a term of years of a portion of the Bay Lands adjoining the town. ..The principle which guided the refusal was, as we understood it, the determination not to allow so much valuable land to become alienated, without any power being reserved to provide for municipal necessities.",
alienated,"Nov 9, 1895",Evening Post,,2,,"""Where is the money to come from?"" queried Mr. Reeves. I reply that no money at all is needed; and, further, that the re-purchase of alienated land is not only inefficient, but wrong in principle.",
alienated,"Oct 5, 1906",Evening Post,,7,,"The tenants have got the land for 999 years, and while we recognise the absurdity of that lease it cannot be broken without the consent of both parties. We may say, therefore, that the land is permanently alienated at present.",
alienated,"Sep 28, 1881",Timaru Herald,,2,,"They [the Maori] are sowing and planting extensively and seem quite engrossed in agriculture, excepting the chosen band who fence on the alienated land.",
alienation,"Jun 8, 1893",Otago Witness,,14,,"If he made such a statement he out-Seddoned-Seddon, as the amount mentioned is many millions of acres in excess of the total amount of land reserved, alienated, or held with right of alienation, in the colony; and, indeed his figures approach the half of the gross acreage of New Zealand.",
alienation,"Oct 14, 1919",Poverty Bay Herald,,5,,"The chairman could be restrained by prohibition if the Board was acting without jurisdiction in confirming this alienation. Defendant's application for confirmation had been opposed by plaintiff, who, His Honor understood, did not then apply for confirmation. The real objection was that the Native transferrors [sic] purported to alienate the land before their own title by succession was complete.",
alienation,"Oct 28, 1901",Evening Post,,4,,"But as the Premier plainly told the House last week, a great deal of pressure is being brought to bear on Ministers to induce them to legislate in the direction of freetrade in native lands. For our part, we have always opposed further alienation in fee in favour of leasing by the Crown as trustees for the owners.",
alienation,"Nov 1, 1854",Nelson Examiner and New Zealand Chronicle,,2,,"By clause 74 it is enacted that ""in respect of all sales or other alienations of any waste lands of the Crown in New Zealand, in fee simple or any less estate or interest (except as therein particularly mentioned), there shall be paid to the New Zealand Company, in discharge of the principal sum and interest due to them, one fourth part of the sum paid by the purchaser in respect of every such sale or alienation.""",
alienation,"Jan 7, 1910",Bay of Plenty Times,,4,,"The other way to effect an alienation is to get the consent of the assembled owners. Any meeting of not less than five of the owners of native freehold land called together by the Maori Land Board, may agree to the alienation of the block by a majority vote, which would bind the whole number of owners.",
alienation,"Mar 12, 1842",Nelson Examiner and New Zealand Chronicle,,2,,"The plan now adopted by the Government for securing to the native inhabitants of these islands a share in the advantages derived from the alienation of their lands to a more civilized race, seems to us calculated, if faithfully carried into effect, to preserve the native race and to raise them to the rank of civilized men.",
alienation,"Oct 7, 1870",Hawke's Bay Herald,,2,,"NATIVE LAND FRAUDS PREVENTION ACT.One of the most important Acts, as far as the North Island is concerned, passed during the last session of the General Assembly, is the above. Its object is, as stated in the preamble, ""To prevent improvident dealings and frauds upon the alienation of land held by natives.""",
alienation,"Nov 15, 1880",Hawke's Bay Herald,,3,,"We have carefully considered the matter and, under the existing circumstamces we have determined to prohibit the alienation of this land for the present.",
alienation,"Feb 26, 1869",Richmond-Atkinson Papers,,2/281,,"I have drafted a letter proposing ... a treaty, the basis to be the return of the unsold or alienated lands in Waikato ...",Richmond-Atkinson Papers (1960)(J.C. Richmond)
alienation,"May 8, 1860",Selected Documents,,108d,,"To preserve this [landed] inheritance unimpaired was a primary object of their cares; to this end two restrictions were necessary; first, upon the right of alienation; and second, upon the liberty of marriage.",G.A. Selwyn Memorandum to Governor Gore Browne
alienation,1860,Maori King Movement,BUDDLE,15,,"The objection ... arose from the foolish idea that is entertained by the Maories that opening roads will certainly lead to the alienation of their lands; as their main object clearly was the formation of a land league to prevent all further sales, ... ibid 20. Their watchword is, `No further alienation of Maori territory.'",
alienation,1863,Mahoe Leaves,MOSER,10,,"`True! ... but seeing that you have set your faces directly against Immigration[sic] - endeavoured to thwart ... the alienation of lands, you have made yourself enemies of those ... considered as a portion of your flock; ...",
alienation,1984,Te Maori,,31,,"In addition, the concept of tangata whenua (people of the land) remains intact despite the alienation of the land.",
Alison,"Feb 14, 1988",Dominion Sunday Times,,19,,"Abbreviated local rhyming slang is also used. `I'd love an aristotle of alison' means `I'd love a bottle of bourbon' - bourbon rhyming with Alison Durbin. [a NZ singer of ?1960s] Meths is blue or white lady, and steam is a mixture of meths and sherry.",
alki-anonymous,1974,Islands,,7 : 5,,"... You see, my family have become tee-totes. Father's joined the A.A. So the reception was dry, ... Father's an alki-anonymous you know. ...'",
all aboard,"Jan 9, 1907",Tuapeka Times,,4,,"Yards full of sheep, dogs barking, men shouting, and the click, click of shears are the chaotic sounds and sights of a station in full shearing swing. Clear the board, all aboard, smoke-o, is the usual shearing vernacular heard in a shed.",
all aboard,1897,Station Ballads,McKEE WRIGHT,,,"`All aboard! All aboard!' is the cry./ They're a ripping lot of shearers in the shed;/ ... / `Wool away! Wool away!' is the cry/ And the merry game of busting is begun!/ They're going sheep and sheep, for Big Mick will do or die,/ And the fleecy boys are kept upon the run./ ... [fn] In old-time sheds these calls indicated the beginning and end of a run.",in 1950 Woodhouse Farm and Station Verse 33
all aboard,1911,Maoriland Bush,KOEBEL,22,,... the stentorian cry to commence [shearing] `all aboard'.,
all aboard,"Dec 28, 1904",Otago Witness,,74,,"Those present answered to their names, and at once preceded to draw lots for their places on the board, after which they got their shears, oil-stone, oil-rag, and water pot ready, so that they should be prepared to start when the bell rang for all aboard.",
all aboard,"Dec 2, 1897",Otago Witness,,58,,"""All right"", said the boss. ""All aboard!"" The men rushed into the catching pens, jostling one another with good-humoured banter as they pulled out their sheep.",
All Black,1907,Elixir of Life,SATCHELL,93,,Arnold the `All Black.',
All Black,1908,British Rugby Team in Maoriland,BARR,11,,"R.G.Deans, the late-lamented All Black. ibid 38 McDonald, the All Black, and captain of the [Otago] team, led his men finely ... <i>Ibid.</i> 48 [not mentioned in first home match in NZ : p50 refers `played for Wales against the All Blacks' but also `Every man on the New Zealand team'] Fifth Match - v. New Zealand. <i>Ibid.</i> 83 [first use in report of tenth match (June 27 1908 at Athletic Park) frequent after this] TENTH MATCH - v. NEW ZEALAND ... New Zealand took the field hot favourites, but the game had not long been in progress before the public supporting the All Blacks ... <i>Ibid.</i> 167 The [1905] team - which was afterwards to be known the world over as the famous All Blacks - was despatched with many misgivings as to its success in Great Britain. <i>Ibid.</i> 48 [not mentioned in first home match in NZ : p50 refers `played for Wales against the All Blacks' but also `Every man on the New Zealand team'] Fifth Match - v. New Zealand. <i>Ibid.</i> 83 [first use in report of tenth match (June 27 1908 at Athletic Park) frequent after this] TENTH MATCH - v. NEW ZEALAND ... New Zealand took the field hot favourites, but the game had not long been in progress before the public supporting the All Blacks ... <i>Ibid.</i> 167 The [1905] team - which was afterwards to be known the world over as the famous All Blacks - was despatched with many misgivings as to its success in Great Britain.",
All Black,1968,NZ Contemp. Dict. Suppl. (Collins),,2,,"All Black n. and adj. N.Z. rugby representative, first applied to N.Z. team which toured Britain 1905-6, on account of black uniform.",
All Black,1905,NZ Truth,,26/3/4,,"[Football Column] The ground of the Cardiff Club, on which the `All Blacks' will meet ...",
All Black,"Oct 31, 1905",NZ Truth,18,,,"`All Blacks' at Blackheath [headline] `All Black'-heath turned out to Join the throng ...[The 1953 report instances Mr Wiren's scrapbook of the 1905 tour of Britain, compiled at the time: `Page after page he [the modern reader] will look in vain for the phrase `All Blacks'. Instead, he will find match after match headed `The New Zealand Football Team', a term which `The Post', after the first ten victories, commenced to vary with the briefer `Our Footballers'. There may be rival claims to the coining of the famous appellation `All Blacks' ... but Mr Wiren's cuttings first display the words in the report of the Blackheath match in the `Football Evening News' of November 4, 1905. ... Subsequently [to the citation above] Blackheath are referred to as the `Black and Reds' and the New Zealanders as All Blacks without the embellishment ofquotation marks. ... Subsequently the `Daily Mail' for one, adopted the term `All Blacks' in preference to the `Colonial' or `New Zealand' footballers. It was some time before newspapers in this country followed suit.",from Football Evening News [Britain] 1905 Nov 18[Note - month and days may be reversed between the two papers]
All Black,"Jan 6, 1906",NZ Truth,,29/3/3,,"[Football correspondent] The visit of the New Zealand team to Canada will ... give an opportunity ... of watching their skill against the all-blacks. <i>Ibid.</i> 29/7/7 [the first mention outside the Football Column] In the match against Wales, the `All Blacks' were defeated three points to nil.",
All Black,1908,NZ Truth,BARR,22,,"Early on Monday morning Mr.George Dixon (manager of the famous `All Blacks' of 1905, and chairman of the New Zealand Union) ... came on board ...",
All Black,1906,Red Funnel,,2/177,,The `All Blacks' - which descriptive title had been given them owing to their sable uniform.,
